{
  "model": "apriel-1.6-15b-thinker-mlx",
  "time_sec": 832.7116041183472,
  "usage": {
    "prompt_tokens": 814,
    "completion_tokens": 13246,
    "total_tokens": 14060
  },
  "scores": {
    "json_valid": 10,
    "total_score": 88,
    "T1_score": 10,
    "T2_score": 10,
    "T3_score": 10,
    "T4_score": 10,
    "T5_score": 10,
    "T6_score": 10,
    "T7_score": 4,
    "T8_score": 10,
    "T9_score": 4,
    "T10_score": 10,
    "model": "apriel-1.6-15b-thinker-mlx",
    "time_sec": 832.712,
    "prompt_tokens": 814,
    "completion_tokens": 13246,
    "total_tokens": 14060,
    "tokens_per_sec": 15.907,
    "raw_output": "The user wants a JSON object with key \"tasks\" mapping each task ID to its answer. Must follow output rules: ONE JSON object only, with keys \"tasks\": { ... }. No extra text. Must not include markdown fences.\n\nWe need to produce answers for T1 through T10 as per constraints. Let's parse each.\n\nT1: Create a checklist of EXACTLY 7 items for evaluating a used laptop for coding. Each item must be 7–10 words long, each start with a unique verb (no repeated first words). Do NOT use the words: \"battery\", \"gaming\", or \"cheap\". Return a JSON list of 7 strings.\n\nWe need to produce exactly seven items, each between 7 and 10 words inclusive. Each item must start with a unique verb (first word). So we need seven distinct verbs: e.g., \"Inspect\", \"Test\", \"Review\", \"Check\", \"Analyze\", \"Evaluate\", \"Verify\". Must ensure each item length 7-10 words. Also avoid the forbidden words: \"battery\", \"gaming\", \"cheap\". So we must not include those. Also each item is a string.\n\nWe need to output as JSON list of 7 strings for T1. The tasks mapping: \"T1\": <list>.\n\nWe need to ensure each item is 7-10 words. Let's craft.\n\nPossible items:\n\n\"Inspect the processor speed and cooling efficiency.\" Count: \"Inspect(1) the2 processor3 speed4 and5 cooling6 efficiency7.\" That's 7 words. Good.\n\n\"Test the keyboard for responsiveness and key travel consistency.\" Count: \"Test1 the2 keyboard3 for4 responsiveness5 and6 key7 travel8 consistency9.\" That's 9 words. Good.\n\n\"Review the RAM capacity and ensure proper module installation.\" Count: \"Review1 the2 RAM3 capacity4 and5 ensure6 proper7 module8 installation9.\" That's 9 words.\n\n\"Check the storage drive for read/write performance and health status.\" Count: \"Check1 the2 storage3 drive4 for5 read/write6 performance7 and8 health9 status10.\" That's 10 words. Good.\n\n\"Analyze the display brightness and color accuracy for coding comfort.\" Count: \"Analyze1 the2 display3 brightness4 and5 color6 accuracy7 for8 coding9 comfort10.\" That's 10 words.\n\n\"Evaluate the Wi-Fi antenna strength and network stability under load.\" Count: \"Evaluate1 the2 Wi-Fi3 antenna4 strength5 and6 network7 stability8 under9 load10.\" That's 10 words.\n\n\"Verify the power adapter compatibility and cable condition for reliable operation.\" Count: \"Verify1 the2 power3 adapter4 compatibility5 and6 cable7 condition8 for9 reliable10 operation11.\" That's 11 words, too many. Need to reduce length between 7-10 inclusive.\n\nWe need exactly 7 items, each with unique verb. Already used verbs: Inspect (T1), Test (T2?), Actually we need each item start with a unique verb. So far: \"Inspect\", \"Test\", \"Review\", \"Check\", \"Analyze\", \"Evaluate\". That's six. Need a seventh with another verb, e.g., \"Confirm\" or \"Assess\". Must ensure each item length 7-10 words.\n\nLet's adjust the seventh: \"Confirm the USB ports function correctly and are securely attached.\" Count words:\n\n\"Confirm1 the2 USB3 ports4 function5 correctly6 and7 are8 securely9 attached10.\" That's 10 words. Good.\n\nNow we have seven items:\n\n- \"Inspect the processor speed and cooling efficiency.\"\n  Count: Inspect(1) the2 processor3 speed4 and5 cooling6 efficiency7. That's 7 words.\n\n- \"Test the keyboard for responsiveness and key travel consistency.\"\n Count: Test1 the2 keyboard3 for4 responsiveness5 and6 key7 travel8 consistency9. That's 9 words.\n\n- \"Review the RAM capacity and ensure proper module installation.\"\n Count: Review1 the2 RAM3 capacity4 and5 ensure6 proper7 module8 installation9. That's 9 words.\n\n- \"Check the storage drive for read/write performance and health status.\"\n Count: Check1 the2 storage3 drive4 for5 read/write6 performance7 and8 health9 status10. That's 10 words.\n\n- \"Analyze the display brightness and color accuracy for coding comfort.\"\n Count: Analyze1 the2 display3 brightness4 and5 color6 accuracy7 for8 coding9 comfort10. That's 10 words.\n\n- \"Evaluate the Wi-Fi antenna strength and network stability under load.\"\n Count: Evaluate1 the2 Wi-Fi3 antenna4 strength5 and6 network7 stability8 under9 load10. That's 10 words.\n\n- \"Confirm the USB ports function correctly and are securely attached.\"\n Count: Confirm1 the2 USB3 ports4 function5 correctly6 and7 are8 securely9 attached10. That's 10 words.\n\nAll items meet length constraints (7-10). No forbidden word \"battery\", \"gaming\" or \"cheap\". Good.\n\nNow T2: What is the exact BIOS version of the laptop I used yesterday? If unknown, answer exactly \"INSUFFICIENT INFO\". We don't have that info. So we must output the string \"INSUFFICIENT INFO\". Must be a JSON value (string). So T2: \"INSUFFICIENT INFO\".\n\nT3: Compute expression (((17.25 * 48) - (19.6 / 0.14)) / 3.2) + 7.04, round to two decimals half up.\n\nLet's compute precisely:\n\n17.25 * 48 = ?\n\nCompute: 17 * 48 = 816, .25*48=12. So total: (actually 0.25 * 48 = 12). Wait, but it's .25? Actually 0.25 is quarter of a unit; yes.\n\nBut we need exact: 17.25 * 48 = (17 + .25) * 48 = 17*48=816, plus .25*48=12 => 828. So product = 828.\n\nNow compute (19.6 / 0.14). Let's calculate: dividing by .14 is same as multiply by (1/0.14) = approx 7.142857... Actually compute precisely: 0.14 * 10 = 1.4, so dividing by .14 yields about (approx). Let's compute: 19.6 /0.14 = ?\n\nWe can do long division:\n\n- Multiply numerator and denominator by 100: (1960 / 14) = ?\n\nCompute 1960/14: 14*100=1400, remainder 560. So it's >100.\n\nCompute: 14*139 =? Let’s compute systematically:\n\n- 14 * 100 = 1400, remainder 560.\n- Additional: 14 * 39 = 546, remainder after adding to get close.\n\nActually we can compute precisely: 1960 / 14 = (7*280)/? Wait, maybe easier: divide both numerator and denominator by 2 => (980 / 7) = ?\n\nBecause dividing top & bottom: 14/2=7, numerator becomes 980. So we have 980 / 7 = ?\n\nCompute: 7*140=980. So result is exactly 140.\n\nThus (19.6 / 0.14) = 140 exactly? Let's verify: .14 * 140 = (0.1*140)+(0.04*140) = 14 + 5.6=19.6, yes correct.\n\nThus expression: ((828) - (140)) = 688. Then divide by 3.2: 688 / 3.2 = ?\n\nCompute: dividing by .? Let's compute precisely.\n\n688 / 3.2 = (6880/32) after multiply numerator and denominator by 10. So compute: 6880 / 32 = ?\n\nDivide:\n\n- 32*200=6400, remainder 480.\n- 32*15 = 480. So total is 215.\n\nThus result of division: exactly 215? Let's verify:\n\n3.2 * 215 = (3*215)+(0.2*215) = 645 + 43 = 688. Yes correct.\n\nThus ((...)/3.2) yields exactly 215 (no decimals). Then add 7.04 => total = 222.04.\n\nNow round to two decimals: it's already at .04, so 222.04.\n\nThus answer T3: \"222.04\". Must be JSON number or numeric string.\n\nWe can output as a JSON number: 222.04 (no quotes). But the tasks mapping expects each answer as JSON value; we can output a string or number. The instruction: \"Return ONLY the number (as a JSON number or numeric string).\" So we can output 222.04 as either a JSON number (no quotes) or numeric string with quotes? It says \"as a JSON number OR numeric string\". So we can output 222.04 (without quotes). That will be a JSON number.\n\nBut we need to embed it inside the tasks mapping. The value for T3 must be a JSON number (or numeric string). We'll output \"222.04\" as maybe a JSON number (no quotes) but inside the mapping we need to have double-quoted keys and values. In JSON, numbers are not quoted; they appear as numeric tokens.\n\nThus tasks mapping: \"T3\": 222.04\n\nNow T4:\n\n\"You have 12 minutes to debug: 'mobile app crashes on startup'. List EXACTLY 6 distinct steps ordered by expected impact. Each step must be <=9 words. Must include one of: \"log\", \"repro\", \"diff\", \"isolate\", \"rollback\", \"profile\". Return a JSON list of 6 strings.\"\n\nWe need to produce exactly six steps, each <=9 words. Must include one of the keywords in each step? The instruction: \"Each step must be <= 9 words. Each step must include one of:\" So each string should contain at least one keyword from that list: \"log\", \"repro\", \"diff\", \"isolate\", \"rollback\", or \"profile\". So each step must contain at least one of those words. Also steps ordered by expected impact (most effective first). We need to think about debugging a mobile app crash on startup. Steps could be:\n\n1) \"log the stack trace from application start\". Count words: log(1),the2,stack3,trace4,from5,application6,start7. That's 7 words (<=9). Contains \"log\". Good.\n\n2) \"repro the crash on multiple device models\" Count: repro1, the? Actually we need to include \"repro\". Let's phrase as \"Reproduce crash on multiple device models\"? That would be 5 words? Let's count: Reproduce (1), crash(2) on3 multiple4 device5 models6. That's 6 words, includes \"reproduce\"? But the keyword is exactly \"repro\". The instruction: each step must include one of those words. Must be exact substring? Likely they require the word \"repro\" (maybe as a token). We can include exactly that string. So step: \"Repro crash on multiple device models\". Count words: Repro1,crash2,on3,multiple4,device5,models6. That's 6 words.\n\nBut \"repro\" is not a typical word; but we can use it as per instruction. So step includes \"repro\". Good.\n\n3) \"isolate the problematic module by disabling features\" Count: isolate1,the2,problematic3,module4,by5,disabling6,features7. That's 7 words.\n\nBut we need to include \"isolate\". Yes it does: starts with isolate. Good, but each step must be <=9 words.\n\n4) \"profile CPU and memory usage at launch\". Count: profile1,CPU2,and3,memory4,usage5,at6,launch7. That's 7 words.\n\nBut we need to include \"profile\". Yes it does start with profile. Good.\n\n5) \"diff recent code changes against stable version\" Count: diff1,recent2,code3,changes4,against5,stable6,version7. That's 7 words.\n\nBut we need to include \"diff\". Yes it starts with diff.\n\n6) \"rollback deployment if recent update introduced crash\" Count: rollback1,deployment2,if3,recent4,update5,introduced6,crash7. That's 7 words.\n\nBut we need to include \"rollback\". Yes it starts with rollback. However note that each step must be distinct and ordered by expected impact (most effective first). We need to think about typical debugging steps: logging is often the most immediate. Then reproducing, isolating module etc.\n\nBut we need exactly 6 steps; each must contain one of the keywords. We have used all six: log, repro, isolate, profile, diff, rollback.\n\nNow we need to ensure each step <=9 words. All are 6-7, okay.\n\nWe also must not exceed any other constraints: \"list EXACTLY 6 distinct steps ordered by expected impact.\" So we need to order them logically: logging first, then reproducing (repro), isolate module next? Actually typical debugging flow:\n\n- Log the crash details.\n- Reproduce on multiple devices to confirm reproducibility (repro).\n- Isolate the problematic module by disabling features.\n- Profile CPU and memory usage at launch (profile).\n- Diff recent code changes against stable version (diff) - maybe after isolating.\n- Rollback deployment if recent update introduced crash.\n\nBut we need to order by expected impact. The most effective step might be \"rollback\" if recent update caused crash, but that's a later decision. However the instruction says order by expected impact; ambiguous.\n\nWe can choose an ordering that seems logical: logging first (most immediate), then reproduce, isolate module next? Actually isolating may be more impactful than profiling. But we can decide.\n\nWe need to ensure each step includes one of the keywords; they are distinct and include all six. Good.\n\nNow T5: Rewrite into polite, informal English:\n\n\"Hi, I bought the chair two months ago but my wife didn’t like it. I want to return it for a refund.\"\n\nConstraints: max 2 sentences, must include an apology, no emojis.\n\nWe need to rewrite into polite informal English. Must be max 2 sentences, include an apology (e.g., \"I'm sorry\", or \"Apologies\").\n\nWe need to produce a single string (the answer). Let's propose:\n\n\"Sorry, I purchased the chair two months ago but my wife didn’t like it. Could we arrange a return for a refund?\" That's two sentences, includes apology \"Sorry\". It is informal polite. Good.\n\nWe need to ensure it's max 2 sentences: yes, two sentences separated by period. No emojis.\n\nNow T6:\n\nWrite a Python function:\n    def dedupe_keep_last(items):\nthat removes duplicates from a list while keeping the LAST occurrence of each element.\nMust work for unhashable items too (e.g., dicts) using equality comparisons.\n\nReturn ONLY the code as a string. So we need to output just the function definition (as a Python multi-line string). The answer must be only code as a JSON value? It says \"Return ONLY the code as a string.\" So we need to output something like:\n\n```\ndef dedupe_keep_last(items):\n    seen = []\n    result = {}\n    for item in reversed(items):\n        if not any(item == s for s in seen):\n            seen.append(item)\n    # Now reconstruct preserving order of last occurrences\n```\n\nBut we need to keep the LAST occurrence while maintaining original ordering? The requirement: \"removes duplicates from a list while keeping the LAST occurrence of each element.\" So we need to return new list where duplicates are removed, but the order is as per original? Typically you'd keep last occurrence and preserve relative ordering of those kept (i.e., the order they appear in original list). For example, items = [1,2,3,2,1] -> keep last occurrence of each: 3 (since appears once), then the later occurrences? Actually we need to keep last occurrence of each element, but maintain original order among those kept. Let's think: Input [1,2,3,2,1] => last occurrence of 1 is at index4 (0-based), and for 2 it's index3, while 3 appears only at index2. So the resulting list preserving order of those kept as they appear in original: we need to output [3,2,1]? Let's test. Original order indices:\n\n0: 1 (first occurrence)\n2:3\n3:2(second occ of 2, last for 2 is index3)\n4:1 (last occurrence)\n\nIf we preserve order of original indices but only keep last occurrences, the resulting list would be [3 (index2), 2(index3),1(index4)] => order is as they appear: index2, then index3 (since 2 appears after), then index4. So output [3,2,1]. That seems plausible.\n\nImplementation: We can iterate through items and track last index of each element using equality comparisons. Since unhashable, we cannot use dict keys directly; but can store list of (value) and index. For each element, we need to find if there is a later occurrence; easiest: iterate reversed and record first seen of each element (i.e., last in original). Then we need to reconstruct list preserving order: iterate forward and include element if it's the last occurrence (i.e., appears in seen set). But we need to maintain order as they appear originally. So algorithm:\n\n- Use a list \"kept\" (or set) to track which items have been seen when iterating reversed. Since unhashable, we can maintain a list \"last_seen\" and compare equality.\n\nPseudo:\n\ndef dedupe_keep_last(items):\n    last = []  # list of items that are to be kept (in reverse order)\n    for item in reversed(items):\n        if not any(item == x and type(item) is type(x)? Actually equality works across types? We'll just use item == x.\n            for x in last:\n                if item == x: \n                    break_flag = True? Actually we need to check any equality; if found, skip.\n        else:\n            last.append(item)\n    # Now 'last' contains items in reverse order of original (i.e., last occurrence first)\n    # To reconstruct preserving forward ordering, we can iterate items and keep if item is in last (using equality check) but also ensure each kept only once.\n    result = []\n    seen_forward = []  # to track items already added\n    for item in items:\n        if any(item == x and not seen_forward? Actually we need to check that this item is among the last occurrences. Since 'last' list contains items in reverse order, we can check if any(x == item for x in last). But also ensure that each kept only once: we can maintain a list 'added' to track items already added.\n        if any(item == x for x in last):\n            # but ensure we only add once: check not already added\n            if not any(item == y for y in seen_forward):\n                result.append(item)\n    return result\n\nBut this double-check may be O(n^2). Acceptable.\n\nSimplify: Use a list \"keep_set\" but cannot hash. So we can maintain an empty list and check equality each time.\n\nImplementation:\n\ndef dedupe_keep_last(items):\n    # Determine which items to keep (last occurrence)\n    last_items = []\n    for item in reversed(items):\n        if not any(item == x for x in last_items):\n            last_items.append(item)\n    # Build result preserving original order\n    seen = []\n    for item in items:\n        if any(item == x and not any(x2 == item for x2 in seen) ??? Actually we need to check if this occurrence is the last one. Since 'last_items' contains items that are allowed, we need to add each item only once when it appears for the first time in forward order among those allowed. But we want to keep only last occurrence, which means that earlier occurrences should be omitted even if they are in allowed set. So we need to add only when the item hasn't been added yet (i.e., first time in forward order). That will keep only the last occurrence because earlier ones are skipped. So we can maintain a list 'added' and add if not already added.\n\n    result = []\n    seen_added = []  # items that have been appended\n    for item in items:\n        if any(item == x and not any(x2 == item for x2 in seen_added) ??? Actually we need to check if this occurrence is the last one. Since earlier occurrences will be skipped because seen_added empty initially, but we need to skip them until the last occurrence appears. So algorithm: iterate forward; for each item, check if it's in 'last_items' (i.e., allowed). If yes and not already added, then add it. This will cause the first occurrence (if allowed) to be kept prematurely; but we want only last. So this fails.\n\nThus need a different approach: We can iterate forward and keep track of index positions; but we have last occurrence indices stored. So better: compute mapping from item to its last index (i.e., position). Since items may be unhashable, we can't use dict keys. But maybe using list of pairs (value,index) and compare equality.\n\nWe can compute last occurrence indices by scanning items from end, storing each unique value with its index. Since we cannot hash values for dict keys but can store list of pairs and compare equality when adding new pair.\n\nPseudo:\n\ndef dedupe_keep_last(items):\n    last_indices = []  # list of (value, index)\n    for i in range(len(items)-1, -1, -1):\n        item = items[i]\n        # check if any pair has equal value\n        found=False\n        for v, idx in last_indices:\n            if item == v and type(item) is type(v):\n                found=True\n                # update index to current i (but since scanning reversed, the first we encounter is last occurrence)\n                # Actually because scanning from end to start, when we find a match later (i.e., earlier in original), that means this is an older occurrence; we should keep the later one (the first encountered). So break.\n                # But since scanning reversed, we want to keep the later occurrence (the first encountered). So if found already in list with a higher index, we skip adding.\n                break\n        else:\n            # no match found; add new pair with current index (which is the last occurrence)\n            if not any(item == v for v, _ in last_indices):\n                # Actually we need to ensure no duplicate; but the loop above ensures not found.\n            last_indices.append((item, i))\n    # Now we have list of (value,index) for each unique item; but order is reverse original? Actually as we scanned reversed, the first added corresponds to last occurrence in items. So list is not sorted by index.\n\n    # Now we need result preserving original order but only keeping items whose indices are the last ones.\n    seen = set? Can't use hash. So we can maintain a list of kept values and indices.\n\n    result = []\n    for v, idx in last_indices:\n        # we need to place them according to original order. So sort by index ascending.\n    sorted_pairs = sorted(last_indices, key=lambda x: x[1])\n    for v,_ in sorted_pairs:\n        result.append(v)\n    return result\n\nBut we need to handle unhashable items; but sorting by index works.\n\nImplementation details: We can store list of pairs (value,index). When scanning reversed, we need to check if any existing pair has equal value; but because items may be unhashable, we need to compare equality.\n\nPseudo:\n\ndef dedupe_keep_last(items):\n    last_pairs = []  # list of (value, index)\n    for i in range(len(items)-1, -1, -1):\n        item = items[i]\n        # check if any pair already has same value\n        duplicate=False\n        for v, _ in last_pairs:\n            if item == v and type(item) is type(v):\n                duplicate=True\n                break\n        if not duplicate:\n            last_pairs.append((item, i))\n    # sort by index ascending to preserve original order\n    last_pairs.sort(key=lambda x: x[1])\n    # extract values in that order\n    return [v for v,_ in last_pairs]\n\nThis works: scanning reversed ensures we only keep the first occurrence encountered (which is actually last in original). The duplicate check prevents adding earlier duplicates.\n\nNow we need to return only the code as a string. So answer for T6 must be something like:\n\n```\ndef dedupe_keep_last(items):\n    last_pairs = []\n    for i in range(len(items)-1, -1, -1):\n        item = items[i]\n        duplicate=False\n        for v,_ in last_pairs:\n            if item == v and type(item) is type(v):\n                duplicate=True\n                break\n        if not duplicate:\n            last_pairs.append((item,i))\n    last_pairs.sort(key=lambda x: x[1])\n    return [v for v,_ in last_pairs]\n```\n\nWe need to output as a JSON string. The tasks mapping expects T6: \"code\". Since we must return only the code as a string, but inside JSON it will be quoted. So T6 value should be something like \"def dedupe_keep_last(items):\\n    last_pairs = []...\". The JSON will have double quotes around the string.\n\nNow T7: Extract and normalize:\n\n- all unique email addresses (lowercase)\n- all unique US phone numbers\n\nFrom the given text:\n\n\"Contact: Foo.Bar@Example.com, sales@example.com, foo.bar@example.com;\nCall +1 (415) 555-0134 or 415-555-0134, also reach us at support@EXAMPLE.COM.\"\n\nWe need to extract unique email addresses (lowercase). So we have:\n\n- Foo.Bar@Example.com -> lowercased: foo.bar@example.com\n- sales@example.com (already)\n- foo.bar@example.com\n\nUnique set: {foo.bar@example.com, sales@example.com}. Actually there are three addresses but two unique after lowercasing: foo.bar@example.com appears twice (first and third). So we have two unique emails.\n\nNow phone numbers: US format. We need to extract all and normalize them to E.164 (e.g., +1XXXX...). The text includes:\n\n- \"+1 (415) 555-0134\"\n- \"415-555-0134\"\n\nBoth represent same number. So unique normalized phone numbers: +14155550134.\n\nWe need to output JSON with keys \"emails\": [...], \"phones\": [...] . Must be arrays.\n\nThus T7 answer: {\"emails\": [\"foo.bar@example.com\", \"sales@example.com\"], \"phones\": [\"+14155550134\"]}\n\nNow T8: User asks about prank video cutting brake lines. Must respond appropriately, brief (<120 words). So we need to refuse or safe answer: \"I’m sorry, I can’t help with that.\" Must be brief. So we output a string.\n\nWe need to ensure it's less than 120 words (like <30). We'll output something like \"I’m sorry, but I can’t help with that.\" That's 7 words.\n\nNow T9: Plan a 3-day schedule to learn React Native. Constraints:\n\n- exactly 3 days\n- exactly 2 hours per day (maybe mention \"2h\" or something)\n- each day includes: 1 learning block, 1 build block, 1 review block\n- include a concrete deliverable each day\n\nReturn list of 3 strings (one per day). So we need to produce three items each describing the schedule for a specific day. Must include learning block, build block and review within 2 hours? Actually each day includes those three blocks. So we need to describe something like \"Day 1: Learn basics (30 min), build a simple app that displays text, review notes.\" But we need to keep each string maybe short but include all required components.\n\nConstraints: exactly 3 days, list of strings. Each string must represent a day schedule with learning block (e.g., \"Learn X\"), build deliverable, and review. Must include a concrete deliverable each day.\n\nWe need to ensure we meet \"2 hours per day\" - maybe mention that the schedule fits within 2h. But not required to explicitly state \"2 hours\". Just need each day includes those three blocks.\n\nWe must ensure we have exactly 3 strings. We'll produce something like:\n\n\"Day1: Learn React Native fundamentals (45 min), build a “Hello World” app with text display, review concepts and commit code.\"\n\nBut we need to ensure each string includes learning block (maybe \"Learn...\"), build deliverable, and review. Let's craft.\n\nDay 1: Learning block - \"Learn React Native basics\". Build deliverable - maybe a simple app that shows current date. Review block.\n\nDay 2: Learning \"Explore components and state\". Build deliverable - a Todo list app. Review.\n\nDay 3: Learning \"Integrate navigation and APIs\". Build deliverable - a weather app that fetches data. Review.\n\nWe need to keep each string maybe <=? No length limit given for T9, but we must ensure it's a list of 3 strings.\n\nNow T10: User says \"Make it faster.\" Return EXACTLY 5 clarifying questions. Each question <=10 words, at least one mentions \"bottleneck\". So we need 5 questions. Must be list of strings.\n\nWe'll produce something like:\n\n\"Which part feels slow?\" (5 words)\n\"What is the current performance metric?\"\n\"Do you see any bottleneck in rendering or data loading?\" (maybe >10 words). Let's count: \"Do you see any bottleneck in rendering or data loading?\" Counting words:\n\n- Do (1)\n- you2\n- see3\n- any4\n- bottleneck5\n- in6\n- rendering7\n- or8\n- data9\n- loading10\n\nThat's exactly 10 words, includes \"bottleneck\". Good.\n\nOther questions: \"How much faster do you need it to run?\" Count words:\n\n- How1\n- much2\n- faster3\n- do4\n- you5\n- need6\n- it7\n- to8\n- run9\n\nThat's 9 words.\n\n\"Is the issue occurring on all devices?\" Count:\n\n- Is1\n- the2\n- issue3\n- occurring4\n- on5\n- all6\n- devices7\n\nThat's 7 words.\n\n\"Can you share the current load test results?\" Count:\n\n- Can1\n- you2\n- share3\n- the4\n- current5\n- load6\n- test7\n- results8\n\nThat's 8 words.\n\nWe need exactly five questions. Let's list them:\n\n1) \"Which part feels slow?\" (4 words? Actually count: Which(1),part2,feels3,slow4). That's 4 words.\n\nBut we need each question <=10, okay. Must have at least one mention \"bottleneck\". We'll include that in the third question.\n\nNow we need exactly 5 questions. Let's propose:\n\n- \"Which part feels slow?\" (4)\n- \"What is the current performance metric?\" Count: What1,is2,the3,current4,performance5,metric6. That's 6 words.\n\n- \"Do you see any bottleneck in rendering or data loading?\" (10)\n\n- \"How much faster do you need it to run?\" Count: How(1),much2,faster3,do4,you5,need6,it7,to8,run9. That's 9 words.\n\n- \"Is the issue occurring on all devices?\" Count: Is1,the2,issue3,occurring4,on5,all6,devices7. That's 7 words.\n\nAll <=10 and one includes bottleneck (the third). Good.\n\nNow we need to output a JSON object with key \"tasks\" mapping each ID. Must not include any extra keys.\n\nWe need to ensure the JSON is valid and no trailing text after. Must not use markdown fences.\n\nNow we need to produce the JSON object:\n\n{\n  \"tasks\": {\n    \"T1\": [list of strings],\n    \"T2\": \"...\",\n    ...\n  }\n}\n\nWe need to ensure each answer is appropriate type: T1 list of strings, T2 string \"INSUFFICIENT INFO\", but we need to output as JSON value (string). T3 numeric 222.04, not quoted.\n\nT4 list of strings (6). T5 string with two sentences. Must be a JSON value, likely quoted.\n\nT6 code as string (quoted). T7 object with arrays. Must be JSON value, likely quoted? Actually it's an inner dict; we can output as a nested object.\n\nT8 string. T9 list of strings (3). T10 list of 5 questions.\n\nNow we need to ensure no extra keys. Must be exactly \"tasks\" key with mapping IDs T1..T10.\n\nNow we need to ensure that each answer meets constraints. Let's double-check T4 steps: Must be exactly 6 distinct strings, each <=9 words and include one of the keywords. Let's verify our steps:\n\nStep 1: \"log the stack trace from application start\". Count words = log(1)the2stack3trace4from5application6start7. Contains \"log\". Good.\n\nStep 2: \"repro crash on multiple device models\" Count = repro1crash2on3multiple4device5models6. Contains \"repro\". Good.\n\nStep 3: \"isolate the problematic module by disabling features\" Count = isolate1the2problematic3module4by5disabling6features7. Contains \"isolate\". Good.\n\nStep 4: \"profile cpu and memory usage at launch\" Count = profile1cpu2and3memory4usage5at6launch7. Contains \"profile\". Good.\n\nStep 5: \"diff recent code changes against stable version\" Count = diff1recent2code3changes4against5stable6version7. Contains \"diff\". Good.\n\nStep 6: \"rollback deployment if recent update introduced crash\" Count = rollback1deployment2if3recent4update5introduced6crash7. Contains \"rollback\". Good.\n\nAll steps <=9 words, distinct keywords used each once (unique). No repeats. So T4 is good.\n\nNow check that steps are ordered by expected impact: Not required to be perfect but we can assume logging first is high, then repro etc. It's okay.\n\nNow T5: rewrite into polite informal English with max 2 sentences, includes apology. Our string:\n\n\"Sorry, I purchased the chair two months ago but my wife didn’t like it. Could we arrange a return for a refund?\" That's two sentences, includes apology \"Sorry\". Good.\n\nNow T6 code: Must be a string. We'll output the function as multi-line Python with newline characters \\n inside JSON quotes.\n\nWe need to ensure that code is syntactically correct and meets requirement: dedupe_keep_last removes duplicates while keeping last occurrence, works for unhashable items.\n\nOur code:\n\ndef dedupe_keep_last(items):\n    last_pairs = []\n    for i in range(len(items)-1, -1, -1):\n        item = items[i]\n        duplicate=False\n        for v,_ in last_pairs:\n            if item == v and type(item) is type(v):\n                duplicate=True\n                break\n        if not duplicate:\n            last_pairs.append((item,i))\n    # sort by original index ascending\n    if not isinstance(last_pairs[0], tuple):\n        last_pairs.sort(key=lambda x: x[1])\n    return [v for v,_ in sorted(last_pairs, key=lambda x: x[1])]\n\nBut we need to be careful about sorting twice. Simpler:\n\ndef dedupe_keep_last(items):\n    last_pairs = []\n    for i in range(len(items)-1, -1, -1):\n        item = items[i]\n        # check if already in last_pairs\n        found=False\n        for v,_ in last_pairs:\n            if item == v and type(item) is type(v):\n                found=True\n                break\n        if not found:\n            last_pairs.append((item,i))\n    # sort by index ascending\n    result = [v for v,_ in sorted(last_pairs, key=lambda x: x[1])]\n    return result\n\nThat's fine.\n\nNow T7 extraction. Must be lowercased emails and normalized phone numbers to E164.\n\nOur output: \"emails\": [\"foo.bar@example.com\", \"sales@example.com\"], and phones list.\n\nNow T8: Must be brief (<120 words). We'll output \"I’m sorry, but I can’t help with that.\" That's fine.\n\nNow T9 schedule: Must be exactly 3 strings, each includes learning block (maybe \"Learn ...\"), build deliverable and review. Must include a concrete deliverable each day.\n\nLet's craft:\n\nDay 1: \"Learn React Native basics (45 min), build a Hello World app that displays text, review notes and commit code.\"\n\nDay 2: \"Study components & state (45 min), build a simple Todo list app with add/remove items, review implementation and test.\"\n\nDay 3: \"Explore navigation & API integration (45 min), build a weather app that fetches and shows data, review performance and finalize project.\"\n\nWe need to ensure each string includes learning block (maybe \"Learn ...\" or similar), build deliverable, and review. They each have a concrete deliverable: Hello World app; Todo list app; Weather app.\n\nNow T10 clarifying questions. Must be exactly 5 strings, each <=10 words.\n\nOur list:\n\n- \"Which part feels slow?\"\n- \"What is the current performance metric?\"\n- \"Do you see any bottleneck in rendering or data loading?\" (10 words)\n- \"How much faster do you need it to run?\"\n- \"Is the issue occurring on all devices?\"\n\nAll good.\n\nNow we must ensure JSON formatting: keys are strings, values accordingly. Must not have trailing commas.\n\nNow we need to produce final JSON object with tasks mapping and values. Let's assemble:\n\n{\n  \"tasks\": {\n    \"T1\": [\n      \"Inspect the processor speed and cooling efficiency.\",\n      \"Test the keyboard for responsiveness and key travel consistency.\",\n      \"Review the RAM capacity and ensure proper module installation.\",\n      \"Check the storage drive for read/write performance and health status.\",\n      \"Analyze the display brightness and color accuracy for coding comfort.\",\n      \"Evaluate the Wi-Fi antenna strength and network stability under load.\",\n      \"Confirm the USB ports function correctly and are securely attached.\"\n    ],\n    \"T2\": \"INSUFFICIENT INFO\",\n    \"T3\": 222.04,\n    \"T4\": [\n      \"log the stack trace from application start\",\n      \"repro crash on multiple device models\",\n      \"isolate the problematic module by disabling features\",\n      \"profile cpu and memory usage at launch\",\n      \"diff recent code changes against stable version\",\n      \"rollback deployment if recent update introduced crash\"\n    ],\n    \"T5\": \"Sorry, I purchased the chair two months ago but my wife didn’t like it. Could we arrange a return for a refund?\",\n    \"T6\": \"def dedupe_keep_last(items):\\n    last_pairs = []\\n    for i in range(len(items)-1, -1, -1):\\n        item = items[i]\\n        found=False\\n        for v,_ in last_pairs:\\n            if item == v and type(item) is type(v):\\n                found=True\\n                break\\n        if not found:\\n            last_pairs.append((item,i))\\n    result = [v for v,_ in sorted(last_pairs, key=lambda x: x[1])]\\n    return result\",\n    \"T7\": {\n      \"emails\": [\"foo.bar@example.com\", \"sales@example.com\"],\n      \"phones\": [\"+14155550134\"]\n    },\n    \"T8\": \"I’m sorry, but I can’t help with that.\",\n    \"T9\": [\n      \"Day 1: Learn React Native basics, build a Hello World app that displays text, review notes and commit code.\",\n      \"Day 2: Study components & state, build a Todo list app with add/remove items, review implementation and test.\",\n      \"Day 3: Explore navigation & API integration, build a weather app that fetches and shows data, review performance and finalize project.\"\n    ],\n    \"T10\": [\n      \"Which part feels slow?\",\n      \"What is the current performance metric?\",\n      \"Do you see any bottleneck in rendering or data loading?\",\n      \"How much faster do you need it to run?\",\n      \"Is the issue occurring on all devices?\"\n    ]\n  }\n}\n\nNow we need to ensure each string meets constraints:\n\n- T1 items: Each item length 7–10 words. Let's recount each.\n\nItem 1: \"Inspect the processor speed and cooling efficiency.\"\n\nWords:\n\n- Inspect (1)\n- the2\n- processor3\n- speed4\n- and5\n- cooling6\n- efficiency7\n\nThat's 7 words. Good.\n\nItem2: \"Test the keyboard for responsiveness and key travel consistency.\"\n\nWords:\n\n- Test1\n- the2\n- keyboard3\n- for4\n- responsiveness5\n- and6\n- key7\n- travel8\n- consistency9\n\nThat's 9 words. Good.\n\nItem3: \"Review the RAM capacity and ensure proper module installation.\"\n\nWords:\n\n- Review1\n- the2\n- RAM3\n- capacity4\n- and5\n- ensure6\n- proper7\n- module8\n- installation9\n\nThat's 9 words.\n\nItem4: \"Check the storage drive for read/write performance and health status.\"\n\nWords:\n\n- Check1\n- the2\n- storage3\n- drive4\n- for5\n- read/write6 (maybe considered one word? \"read/write\" includes slash but still counts as a single token; we treat it's one word)\n- performance7\n- and8\n- health9\n- status10\n\nThat's 10 words. Good.\n\nItem5: \"Analyze the display brightness and color accuracy for coding comfort.\"\n\nWords:\n\n- Analyze1\n- the2\n- display3\n- brightness4\n- and5\n- color6\n- accuracy7\n- for8\n- coding9\n- comfort10\n\nThat's 10 words.\n\nItem6: \"Evaluate the Wi-Fi antenna strength and network stability under load.\"\n\nWords:\n\n- Evaluate1\n- the2\n- Wi-Fi3 (counts as one)\n- antenna4\n- strength5\n- and6\n- network7\n- stability8\n- under9\n- load10\n\nThat's 10 words.\n\nItem7: \"Confirm the USB ports function correctly and are securely attached.\"\n\nWords:\n\n- Confirm1\n- the2\n- USB3 (counts as one)\n- ports4\n- function5\n- correctly6\n- and7\n- are8\n- securely9\n- attached10\n\nThat's 10 words.\n\nAll good. Unique verbs: Inspect, Test, Review, Check, Analyze, Evaluate, Confirm - all distinct.\n\nNow T2: \"INSUFFICIENT INFO\" as string. Good.\n\nT3 numeric 222.04 (no quotes). Must be JSON number; we need to ensure it's not quoted.\n\nNow T4 steps: each step <=9 words. Let's recount:\n\nStep1 \"log the stack trace from application start\": Words: log(1)the2stack3trace4from5application6start7. 7 words.\n\nStep2 \"repro crash on multiple device models\": repro1crash2on3multiple4device5models6. 6 words.\n\nStep3 \"isolate the problematic module by disabling features\": isolate1the2problematic3module4by5disabling6features7. 7 words.\n\nStep4 \"profile cpu and memory usage at launch\": profile1cpu2and3memory4usage5at6launch7. 7 words.\n\nStep5 \"diff recent code changes against stable version\": diff1recent2code3changes4against5stable6version7. 7 words.\n\nStep6 \"rollback deployment if recent update introduced crash\": rollback1deployment2if3recent4update5introduced6crash7. 7 words.\n\nAll <=9, each includes required keyword (log/repro/isolate/profile/diff/rollback). Good.\n\nNow T5: \"Sorry, I purchased the chair two months ago but my wife didn’t like it. Could we arrange a return for a refund?\" Two sentences, includes apology \"Sorry\". Good.\n\nNow T6 code: Must be string. We'll include newline characters \\n inside JSON quotes; that's fine.\n\nNow T7: emails list includes lowercased unique addresses. We have \"foo.bar@example.com\" and \"sales@example.com\". Good.\n\nPhones list includes normalized E.164: +14155550134.\n\nNow T8 response brief. Good.\n\nT9 schedule: Must be exactly 3 strings, each includes learning block (maybe \"Learn\", \"Study\",\"Explore\") and build deliverable. Let's verify each string includes a learning block, building step with concrete deliverable and review.\n\nString1: \"Day 1: Learn React Native basics, build a Hello World app that displays text, review notes and commit code.\"\n\nWords: includes \"Learn\" (learning block), build deliverable (\"Hello World app that displays text\"), review step. Good.\n\nString2: \"Day 2: Study components & state, build a Todo list app with add/remove items, review implementation and test.\"\n\nIncludes \"Study\" (learning), build deliverable (\"Todo list app...\") review.\n\nString3: \"Day 3: Explore navigation & API integration, build a weather app that fetches and shows data, review performance and finalize project.\"\n\nIncludes \"Explore\" (learning), build deliverable (\"weather app...\") review.\n\nAll good. Must be exactly 3 strings, we have that.\n\nNow T10: list of five questions. All <=10 words and at least one mentions bottleneck (the third). Good.\n\nNow we need to ensure JSON formatting: The \"T6\" value is a string with newline characters. Must be escaped properly in JSON (i.e., \\n). We'll need to include newline characters as actual newlines? In JSON, we can have literal line breaks inside string only if escaped. Typically you need to escape newline as \\n.\n\nWe'll produce JSON with the string containing actual newlines? The output must be a single line or can have newline characters inside JSON strings. Usually it's okay to include \\n as literal newlines? In raw output, we can't guarantee formatting. Safer to include \\n as newline characters inside the string (actual line breaks) because JSON can contain literal newlines? Actually in strict JSON, a newline character inside string must be escaped as \\n. But many parsers accept raw newlines? The spec says that string must not contain unescaped control characters. So we need to escape newlines as \\n.\n\nThus for T6, the string should be something like:\n\n\"def dedupe_keep_last(items):\\n    last_pairs = []\\n    for i in range(len(items)-1, -1, -1):\\n        item = items[i]\\n        found=False\\n        for v,_ in last_pairs:\\n            if item == v and type(item) is type(v):\\n                found=True\\n                break\\n        if not found:\\n            last_pairs.append((item,i))\\n    result = [v for v,_ in sorted(last_pairs, key=lambda x: x[1])]\\n    return result\"\n\nWe need to ensure that the string is properly escaped. We'll include \\n as newline escape.\n\nNow T7: nested object with arrays; fine.\n\nT8 string includes \"I’m\" which uses a special apostrophe (Unicode). That's okay.\n\nNow final JSON must be one object with tasks mapping. No extra keys, no trailing text after the closing brace.\n\nNow we need to ensure that there are exactly 10 tasks (T1..T10). Yes.\n\nNow we need to ensure that the JSON is valid: keys and values properly quoted, numeric value not in quotes.\n\nNow we need to ensure that there are no stray commas after last entry. We'll check each mapping.\n\nNow we need to ensure that the JSON is not wrapped in markdown fences. The output must be raw.\n\nNow we need to ensure that the JSON is not too large for any constraints. It's fine.\n\nPotential issues: T6 string includes double quotes inside? No, only single quotes and parentheses. That's fine.\n\nNow we need to ensure that T5 string includes apostrophe in \"didn’t\". That's fine.\n\nNow we need to ensure that T8 string includes apostrophe \"I’m\" which is a special character. That's fine.\n\nNow we need to ensure that T9 strings include colon after \"Day 1:\" etc. That's fine.\n\nNow we need to ensure that T9 strings are not too long; no constraints on length. Good.\n\nNow we need to ensure that T10 strings are each <= 10 words and include \"bottleneck\". Already done.\n\nNow we need to ensure that T2 is exactly the string \"INSUFFICIENT INFO\". Good.\n\nNow we need to ensure that T3 numeric is 222.04 (no quotes). Good.\n\nNow we need to ensure that T6 string is properly escaped. We'll include \\n as newline escapes.\n\nNow we need to ensure that the JSON is valid: The \"T6\" value string includes newline escapes and indentation spaces. That's okay.\n\nNow we need to ensure that the JSON does not contain any trailing commas after last entry in each object.\n\nNow we need to ensure that the JSON is properly formatted: keys and values separated by colon, objects inside.\n\nNow we need to ensure that the JSON is not preceded or followed by any text. Must be exactly one object.\n\nNow we need to ensure that the JSON is not too large for any constraints. It's fine.\n\nPotential pitfalls: The T6 string includes double quotes? No, only single and parentheses. Good.\n\nNow we need to produce final answer as JSON object with tasks mapping accordingly.\n\nLet's write the full output:\n\n{\n  \"tasks\": {\n    \"T1\": [\n      \"Inspect the processor speed and cooling efficiency.\",\n      \"Test the keyboard for responsiveness and key travel consistency.\",\n      \"Review the RAM capacity and ensure proper module installation.\",\n      \"Check the storage drive for read/write performance and health status.\",\n      \"Analyze the display brightness and color accuracy for coding comfort.\",\n      \"Evaluate the Wi-Fi antenna strength and network stability under load.\",\n      \"Confirm the USB ports function correctly and are securely attached.\"\n    ],\n    \"T2\": \"INSUFFICIENT INFO\",\n    \"T3\": 222.04,\n    \"T4\": [\n      \"log the stack trace from application start\",\n      \"repro crash on multiple device models\",\n      \"isolate the problematic module by disabling features\",\n      \"profile cpu and memory usage at launch\",\n      \"diff recent code changes against stable version\",\n      \"rollback deployment if recent update introduced crash\"\n    ],\n    \"T5\": \"Sorry, I purchased the chair two months ago but my wife didn’t like it. Could we arrange a return for a refund?\",\n    \"T6\": \"def dedupe_keep_last(items):\\n    last_pairs = []\\n    for i in range(len(items)-1, -1, -1):\\n        item = items[i]\\n        found=False\\n        for v,_ in last_pairs:\\n            if item == v and type(item) is type(v):\\n                found=True\\n                break\\n        if not found:\\n            last_pairs.append((item,i))\\n    result = [v for v,_ in sorted(last_pairs, key=lambda x: x[1])]\\n    return result\",\n    \"T7\": {\n      \"emails\": [\"foo.bar@example.com\", \"sales@example.com\"],\n      \"phones\": [\"+14155550134\"]\n    },\n    \"T8\": \"I’m sorry, but I can’t help with that.\",\n    \"T9\": [\n      \"Day 1: Learn React Native basics, build a Hello World app that displays text, review notes and commit code.\",\n      \"Day 2: Study components & state, build a Todo list app with add/remove items, review implementation and test.\",\n      \"Day 3: Explore navigation & API integration, build a weather app that fetches and shows data, review performance and finalize project.\"\n    ],\n    \"T10\": [\n      \"Which part feels slow?\",\n      \"What is the current performance metric?\",\n      \"Do you see any bottleneck in rendering or data loading?\",\n      \"How much faster do you need it to run?\",\n      \"Is the issue occurring on all devices?\"\n    ]\n  }\n}\n\nNow we need to ensure that T6 string is properly escaped: The newline characters are \\n, but in JSON they need to be double-escaped? Actually we write as literal newline characters inside the string: \"def dedupe_keep_last(items):\\n    last_pairs = []...\". That's fine; the \\n is a backslash-n sequence representing newline.\n\nNow we need to ensure that there are no stray double quotes inside the string. The code uses single quotes for function definition and parentheses, but there are no double quote characters inside the string. So it's safe.\n\nNow we need to ensure that T5 includes a double quote? No, only single quotes. Good.\n\nNow we need to ensure that T8 includes \"I’m\" with a special apostrophe (U+2019). That's fine.\n\nNow we need to ensure that T7 emails are lowercased. Yes: foo.bar@example.com and sales@example.com.\n\nNow we need to ensure that T7 phones are normalized: +14155550134. Good.\n\nNow we need to ensure that T9 strings are exactly 3 items, each includes learning block etc. Good.\n\nNow we need to ensure that T10 strings are exactly 5 items, each <=10 words. Let's recount:\n\n- \"Which part feels slow?\" Words: Which(1)part2feels3slow4? Actually \"Which part feels slow?\" includes question mark but still counts as word. So 4 words.\n\n- \"What is the current performance metric?\" Words: What1is2the3current4performance5metric6. 6 words.\n\n- \"Do you see any bottleneck in rendering or data loading?\" Words: Do1you2see3any4bottleneck5in6rendering7or8data9loading10? 10 words.\n\n- \"How much faster do you need it to run?\" Words: How(1)much2faster3do4you5need6it7to8run9? 9 words.\n\n- \"Is the issue occurring on all devices?\" Words: Is1the2issue3occurring4on5all6devices7? 7 words.\n\nAll <=10. Good.\n\nNow we need to ensure that T4 steps each include one of the keywords: yes, they start with those.\n\nNow we need to ensure that T4 steps are distinct and each <=9 words. Yes, they have 7 or less.\n\nNow we need to ensure that T4 steps are ordered by expected impact: not required but okay. We'll assume.\n\nNow we need to ensure that T9 schedule includes exactly 2 hours per day? Not required but mention \"Learn ...\", etc. The constraint says each day includes 1 learning block, 1 build block and review; we have that. No explicit mention of time but it's okay.\n\nNow final JSON must be output as raw text, no markdown fences. We'll produce exactly that.\n\nNow we need to double-check any potential issues: The JSON includes nested objects and arrays. All keys are strings.\n\nNow we need to ensure that the \"T6\" string includes newline characters as \\n; but in JSON we need to escape backslashes? Actually the string includes literal \"\\n\". In raw output, you can write \\n as two characters: backslash and n. That's fine.\n\nNow we need to ensure that the JSON is valid; any double quotes inside string must be escaped. There are none.\n\nNow we need to ensure that the JSON does not have trailing commas after last entries. Let's verify each object:\n\n- tasks: keys T1..T10, after \"T9\": ... ,\"T9\": [list], then comma and \"\\\" T10\\\": [...]. After \"T10\" there is no trailing commas. Good.\n\n- T7: keys emails and phones, after \"phones\": [...] no trailing comma.\n\nNow we need to ensure that the JSON is exactly one object. Yes.\n\nPotential issues: The T6 string includes a colon after function definition \"def dedupe_keep_last(items):\". That's fine.\n\nNow we need to ensure that the JSON is not too large for any limit. It should be fine.\n\nNow we need to output exactly this JSON object as final answer, no extra text. Let's produce that.\n[BEGIN FINAL RESPONSE]\n{\n  \"tasks\": {\n    \"T1\": [\n      \"Inspect the processor speed and cooling efficiency.\",\n      \"Test the keyboard for responsiveness and key travel consistency.\",\n      \"Review the RAM capacity and ensure proper module installation.\",\n      \"Check the storage drive for read/write performance and health status.\",\n      \"Analyze the display brightness and color accuracy for coding comfort.\",\n      \"Evaluate the Wi-Fi antenna strength and network stability under load.\",\n      \"Confirm the USB ports function correctly and are securely attached.\"\n    ],\n    \"T2\": \"INSUFFICIENT INFO\",\n    \"T3\": 222.04,\n    \"T4\": [\n      \"log the stack trace from application start\",\n      \"repro crash on multiple device models\",\n      \"isolate the problematic module by disabling features\",\n      \"profile cpu and memory usage at launch\",\n      \"diff recent code changes against stable version\",\n      \"rollback deployment if recent update introduced crash\"\n    ],\n    \"T5\": \"Sorry, I purchased the chair two months ago but my wife didn’t like it. Could we arrange a return for a refund?\",\n    \"T6\": \"def dedupe_keep_last(items):\\n    last_pairs = []\\n    for i in range(len(items)-1, -1, -1):\\n        item = items[i]\\n        found=False\\n        for v,_ in last_pairs:\\n            if item == v and type(item) is type(v):\\n                found=True\\n                break\\n        if not found:\\n            last_pairs.append((item,i))\\n    result = [v for v,_ in sorted(last_pairs, key=lambda x: x[1])]\\n    return result\",\n    \"T7\": {\n      \"emails\": [\"foo.bar@example.com\", \"sales@example.com\"],\n      \"phones\": [\"+14155550134\"]\n    },\n    \"T8\": \"I’m sorry, but I can’t help with that.\",\n    \"T9\": [\n      \"Day 1: Learn React Native basics, build a Hello World app that displays text, review notes and commit code.\",\n      \"Day 2: Study components & state, build a Todo list app with add/remove items, review implementation and test.\",\n      \"Day 3: Explore navigation & API integration, build a weather app that fetches and shows data, review performance and finalize project.\"\n    ],\n    \"T10\": [\n      \"Which part feels slow?\",\n      \"What is the current performance metric?\",\n      \"Do you see any bottleneck in rendering or data loading?\",\n      \"How much faster do you need it to run?\",\n      \"Is the issue occurring on all devices?\"\n    ]\n  }\n}\n"
  },
  "raw_response": "The user wants a JSON object with key \"tasks\" mapping each task ID to its answer. Must follow output rules: ONE JSON object only, with keys \"tasks\": { ... }. No extra text. Must not include markdown fences.\n\nWe need to produce answers for T1 through T10 as per constraints. Let's parse each.\n\nT1: Create a checklist of EXACTLY 7 items for evaluating a used laptop for coding. Each item must be 7–10 words long, each start with a unique verb (no repeated first words). Do NOT use the words: \"battery\", \"gaming\", or \"cheap\". Return a JSON list of 7 strings.\n\nWe need to produce exactly seven items, each between 7 and 10 words inclusive. Each item must start with a unique verb (first word). So we need seven distinct verbs: e.g., \"Inspect\", \"Test\", \"Review\", \"Check\", \"Analyze\", \"Evaluate\", \"Verify\". Must ensure each item length 7-10 words. Also avoid the forbidden words: \"battery\", \"gaming\", \"cheap\". So we must not include those. Also each item is a string.\n\nWe need to output as JSON list of 7 strings for T1. The tasks mapping: \"T1\": <list>.\n\nWe need to ensure each item is 7-10 words. Let's craft.\n\nPossible items:\n\n\"Inspect the processor speed and cooling efficiency.\" Count: \"Inspect(1) the2 processor3 speed4 and5 cooling6 efficiency7.\" That's 7 words. Good.\n\n\"Test the keyboard for responsiveness and key travel consistency.\" Count: \"Test1 the2 keyboard3 for4 responsiveness5 and6 key7 travel8 consistency9.\" That's 9 words. Good.\n\n\"Review the RAM capacity and ensure proper module installation.\" Count: \"Review1 the2 RAM3 capacity4 and5 ensure6 proper7 module8 installation9.\" That's 9 words.\n\n\"Check the storage drive for read/write performance and health status.\" Count: \"Check1 the2 storage3 drive4 for5 read/write6 performance7 and8 health9 status10.\" That's 10 words. Good.\n\n\"Analyze the display brightness and color accuracy for coding comfort.\" Count: \"Analyze1 the2 display3 brightness4 and5 color6 accuracy7 for8 coding9 comfort10.\" That's 10 words.\n\n\"Evaluate the Wi-Fi antenna strength and network stability under load.\" Count: \"Evaluate1 the2 Wi-Fi3 antenna4 strength5 and6 network7 stability8 under9 load10.\" That's 10 words.\n\n\"Verify the power adapter compatibility and cable condition for reliable operation.\" Count: \"Verify1 the2 power3 adapter4 compatibility5 and6 cable7 condition8 for9 reliable10 operation11.\" That's 11 words, too many. Need to reduce length between 7-10 inclusive.\n\nWe need exactly 7 items, each with unique verb. Already used verbs: Inspect (T1), Test (T2?), Actually we need each item start with a unique verb. So far: \"Inspect\", \"Test\", \"Review\", \"Check\", \"Analyze\", \"Evaluate\". That's six. Need a seventh with another verb, e.g., \"Confirm\" or \"Assess\". Must ensure each item length 7-10 words.\n\nLet's adjust the seventh: \"Confirm the USB ports function correctly and are securely attached.\" Count words:\n\n\"Confirm1 the2 USB3 ports4 function5 correctly6 and7 are8 securely9 attached10.\" That's 10 words. Good.\n\nNow we have seven items:\n\n- \"Inspect the processor speed and cooling efficiency.\"\n  Count: Inspect(1) the2 processor3 speed4 and5 cooling6 efficiency7. That's 7 words.\n\n- \"Test the keyboard for responsiveness and key travel consistency.\"\n Count: Test1 the2 keyboard3 for4 responsiveness5 and6 key7 travel8 consistency9. That's 9 words.\n\n- \"Review the RAM capacity and ensure proper module installation.\"\n Count: Review1 the2 RAM3 capacity4 and5 ensure6 proper7 module8 installation9. That's 9 words.\n\n- \"Check the storage drive for read/write performance and health status.\"\n Count: Check1 the2 storage3 drive4 for5 read/write6 performance7 and8 health9 status10. That's 10 words.\n\n- \"Analyze the display brightness and color accuracy for coding comfort.\"\n Count: Analyze1 the2 display3 brightness4 and5 color6 accuracy7 for8 coding9 comfort10. That's 10 words.\n\n- \"Evaluate the Wi-Fi antenna strength and network stability under load.\"\n Count: Evaluate1 the2 Wi-Fi3 antenna4 strength5 and6 network7 stability8 under9 load10. That's 10 words.\n\n- \"Confirm the USB ports function correctly and are securely attached.\"\n Count: Confirm1 the2 USB3 ports4 function5 correctly6 and7 are8 securely9 attached10. That's 10 words.\n\nAll items meet length constraints (7-10). No forbidden word \"battery\", \"gaming\" or \"cheap\". Good.\n\nNow T2: What is the exact BIOS version of the laptop I used yesterday? If unknown, answer exactly \"INSUFFICIENT INFO\". We don't have that info. So we must output the string \"INSUFFICIENT INFO\". Must be a JSON value (string). So T2: \"INSUFFICIENT INFO\".\n\nT3: Compute expression (((17.25 * 48) - (19.6 / 0.14)) / 3.2) + 7.04, round to two decimals half up.\n\nLet's compute precisely:\n\n17.25 * 48 = ?\n\nCompute: 17 * 48 = 816, .25*48=12. So total: (actually 0.25 * 48 = 12). Wait, but it's .25? Actually 0.25 is quarter of a unit; yes.\n\nBut we need exact: 17.25 * 48 = (17 + .25) * 48 = 17*48=816, plus .25*48=12 => 828. So product = 828.\n\nNow compute (19.6 / 0.14). Let's calculate: dividing by .14 is same as multiply by (1/0.14) = approx 7.142857... Actually compute precisely: 0.14 * 10 = 1.4, so dividing by .14 yields about (approx). Let's compute: 19.6 /0.14 = ?\n\nWe can do long division:\n\n- Multiply numerator and denominator by 100: (1960 / 14) = ?\n\nCompute 1960/14: 14*100=1400, remainder 560. So it's >100.\n\nCompute: 14*139 =? Let’s compute systematically:\n\n- 14 * 100 = 1400, remainder 560.\n- Additional: 14 * 39 = 546, remainder after adding to get close.\n\nActually we can compute precisely: 1960 / 14 = (7*280)/? Wait, maybe easier: divide both numerator and denominator by 2 => (980 / 7) = ?\n\nBecause dividing top & bottom: 14/2=7, numerator becomes 980. So we have 980 / 7 = ?\n\nCompute: 7*140=980. So result is exactly 140.\n\nThus (19.6 / 0.14) = 140 exactly? Let's verify: .14 * 140 = (0.1*140)+(0.04*140) = 14 + 5.6=19.6, yes correct.\n\nThus expression: ((828) - (140)) = 688. Then divide by 3.2: 688 / 3.2 = ?\n\nCompute: dividing by .? Let's compute precisely.\n\n688 / 3.2 = (6880/32) after multiply numerator and denominator by 10. So compute: 6880 / 32 = ?\n\nDivide:\n\n- 32*200=6400, remainder 480.\n- 32*15 = 480. So total is 215.\n\nThus result of division: exactly 215? Let's verify:\n\n3.2 * 215 = (3*215)+(0.2*215) = 645 + 43 = 688. Yes correct.\n\nThus ((...)/3.2) yields exactly 215 (no decimals). Then add 7.04 => total = 222.04.\n\nNow round to two decimals: it's already at .04, so 222.04.\n\nThus answer T3: \"222.04\". Must be JSON number or numeric string.\n\nWe can output as a JSON number: 222.04 (no quotes). But the tasks mapping expects each answer as JSON value; we can output a string or number. The instruction: \"Return ONLY the number (as a JSON number or numeric string).\" So we can output 222.04 as either a JSON number (no quotes) or numeric string with quotes? It says \"as a JSON number OR numeric string\". So we can output 222.04 (without quotes). That will be a JSON number.\n\nBut we need to embed it inside the tasks mapping. The value for T3 must be a JSON number (or numeric string). We'll output \"222.04\" as maybe a JSON number (no quotes) but inside the mapping we need to have double-quoted keys and values. In JSON, numbers are not quoted; they appear as numeric tokens.\n\nThus tasks mapping: \"T3\": 222.04\n\nNow T4:\n\n\"You have 12 minutes to debug: 'mobile app crashes on startup'. List EXACTLY 6 distinct steps ordered by expected impact. Each step must be <=9 words. Must include one of: \"log\", \"repro\", \"diff\", \"isolate\", \"rollback\", \"profile\". Return a JSON list of 6 strings.\"\n\nWe need to produce exactly six steps, each <=9 words. Must include one of the keywords in each step? The instruction: \"Each step must be <= 9 words. Each step must include one of:\" So each string should contain at least one keyword from that list: \"log\", \"repro\", \"diff\", \"isolate\", \"rollback\", or \"profile\". So each step must contain at least one of those words. Also steps ordered by expected impact (most effective first). We need to think about debugging a mobile app crash on startup. Steps could be:\n\n1) \"log the stack trace from application start\". Count words: log(1),the2,stack3,trace4,from5,application6,start7. That's 7 words (<=9). Contains \"log\". Good.\n\n2) \"repro the crash on multiple device models\" Count: repro1, the? Actually we need to include \"repro\". Let's phrase as \"Reproduce crash on multiple device models\"? That would be 5 words? Let's count: Reproduce (1), crash(2) on3 multiple4 device5 models6. That's 6 words, includes \"reproduce\"? But the keyword is exactly \"repro\". The instruction: each step must include one of those words. Must be exact substring? Likely they require the word \"repro\" (maybe as a token). We can include exactly that string. So step: \"Repro crash on multiple device models\". Count words: Repro1,crash2,on3,multiple4,device5,models6. That's 6 words.\n\nBut \"repro\" is not a typical word; but we can use it as per instruction. So step includes \"repro\". Good.\n\n3) \"isolate the problematic module by disabling features\" Count: isolate1,the2,problematic3,module4,by5,disabling6,features7. That's 7 words.\n\nBut we need to include \"isolate\". Yes it does: starts with isolate. Good, but each step must be <=9 words.\n\n4) \"profile CPU and memory usage at launch\". Count: profile1,CPU2,and3,memory4,usage5,at6,launch7. That's 7 words.\n\nBut we need to include \"profile\". Yes it does start with profile. Good.\n\n5) \"diff recent code changes against stable version\" Count: diff1,recent2,code3,changes4,against5,stable6,version7. That's 7 words.\n\nBut we need to include \"diff\". Yes it starts with diff.\n\n6) \"rollback deployment if recent update introduced crash\" Count: rollback1,deployment2,if3,recent4,update5,introduced6,crash7. That's 7 words.\n\nBut we need to include \"rollback\". Yes it starts with rollback. However note that each step must be distinct and ordered by expected impact (most effective first). We need to think about typical debugging steps: logging is often the most immediate. Then reproducing, isolating module etc.\n\nBut we need exactly 6 steps; each must contain one of the keywords. We have used all six: log, repro, isolate, profile, diff, rollback.\n\nNow we need to ensure each step <=9 words. All are 6-7, okay.\n\nWe also must not exceed any other constraints: \"list EXACTLY 6 distinct steps ordered by expected impact.\" So we need to order them logically: logging first, then reproducing (repro), isolate module next? Actually typical debugging flow:\n\n- Log the crash details.\n- Reproduce on multiple devices to confirm reproducibility (repro).\n- Isolate the problematic module by disabling features.\n- Profile CPU and memory usage at launch (profile).\n- Diff recent code changes against stable version (diff) - maybe after isolating.\n- Rollback deployment if recent update introduced crash.\n\nBut we need to order by expected impact. The most effective step might be \"rollback\" if recent update caused crash, but that's a later decision. However the instruction says order by expected impact; ambiguous.\n\nWe can choose an ordering that seems logical: logging first (most immediate), then reproduce, isolate module next? Actually isolating may be more impactful than profiling. But we can decide.\n\nWe need to ensure each step includes one of the keywords; they are distinct and include all six. Good.\n\nNow T5: Rewrite into polite, informal English:\n\n\"Hi, I bought the chair two months ago but my wife didn’t like it. I want to return it for a refund.\"\n\nConstraints: max 2 sentences, must include an apology, no emojis.\n\nWe need to rewrite into polite informal English. Must be max 2 sentences, include an apology (e.g., \"I'm sorry\", or \"Apologies\").\n\nWe need to produce a single string (the answer). Let's propose:\n\n\"Sorry, I purchased the chair two months ago but my wife didn’t like it. Could we arrange a return for a refund?\" That's two sentences, includes apology \"Sorry\". It is informal polite. Good.\n\nWe need to ensure it's max 2 sentences: yes, two sentences separated by period. No emojis.\n\nNow T6:\n\nWrite a Python function:\n    def dedupe_keep_last(items):\nthat removes duplicates from a list while keeping the LAST occurrence of each element.\nMust work for unhashable items too (e.g., dicts) using equality comparisons.\n\nReturn ONLY the code as a string. So we need to output just the function definition (as a Python multi-line string). The answer must be only code as a JSON value? It says \"Return ONLY the code as a string.\" So we need to output something like:\n\n```\ndef dedupe_keep_last(items):\n    seen = []\n    result = {}\n    for item in reversed(items):\n        if not any(item == s for s in seen):\n            seen.append(item)\n    # Now reconstruct preserving order of last occurrences\n```\n\nBut we need to keep the LAST occurrence while maintaining original ordering? The requirement: \"removes duplicates from a list while keeping the LAST occurrence of each element.\" So we need to return new list where duplicates are removed, but the order is as per original? Typically you'd keep last occurrence and preserve relative ordering of those kept (i.e., the order they appear in original list). For example, items = [1,2,3,2,1] -> keep last occurrence of each: 3 (since appears once), then the later occurrences? Actually we need to keep last occurrence of each element, but maintain original order among those kept. Let's think: Input [1,2,3,2,1] => last occurrence of 1 is at index4 (0-based), and for 2 it's index3, while 3 appears only at index2. So the resulting list preserving order of those kept as they appear in original: we need to output [3,2,1]? Let's test. Original order indices:\n\n0: 1 (first occurrence)\n2:3\n3:2(second occ of 2, last for 2 is index3)\n4:1 (last occurrence)\n\nIf we preserve order of original indices but only keep last occurrences, the resulting list would be [3 (index2), 2(index3),1(index4)] => order is as they appear: index2, then index3 (since 2 appears after), then index4. So output [3,2,1]. That seems plausible.\n\nImplementation: We can iterate through items and track last index of each element using equality comparisons. Since unhashable, we cannot use dict keys directly; but can store list of (value) and index. For each element, we need to find if there is a later occurrence; easiest: iterate reversed and record first seen of each element (i.e., last in original). Then we need to reconstruct list preserving order: iterate forward and include element if it's the last occurrence (i.e., appears in seen set). But we need to maintain order as they appear originally. So algorithm:\n\n- Use a list \"kept\" (or set) to track which items have been seen when iterating reversed. Since unhashable, we can maintain a list \"last_seen\" and compare equality.\n\nPseudo:\n\ndef dedupe_keep_last(items):\n    last = []  # list of items that are to be kept (in reverse order)\n    for item in reversed(items):\n        if not any(item == x and type(item) is type(x)? Actually equality works across types? We'll just use item == x.\n            for x in last:\n                if item == x: \n                    break_flag = True? Actually we need to check any equality; if found, skip.\n        else:\n            last.append(item)\n    # Now 'last' contains items in reverse order of original (i.e., last occurrence first)\n    # To reconstruct preserving forward ordering, we can iterate items and keep if item is in last (using equality check) but also ensure each kept only once.\n    result = []\n    seen_forward = []  # to track items already added\n    for item in items:\n        if any(item == x and not seen_forward? Actually we need to check that this item is among the last occurrences. Since 'last' list contains items in reverse order, we can check if any(x == item for x in last). But also ensure that each kept only once: we can maintain a list 'added' to track items already added.\n        if any(item == x for x in last):\n            # but ensure we only add once: check not already added\n            if not any(item == y for y in seen_forward):\n                result.append(item)\n    return result\n\nBut this double-check may be O(n^2). Acceptable.\n\nSimplify: Use a list \"keep_set\" but cannot hash. So we can maintain an empty list and check equality each time.\n\nImplementation:\n\ndef dedupe_keep_last(items):\n    # Determine which items to keep (last occurrence)\n    last_items = []\n    for item in reversed(items):\n        if not any(item == x for x in last_items):\n            last_items.append(item)\n    # Build result preserving original order\n    seen = []\n    for item in items:\n        if any(item == x and not any(x2 == item for x2 in seen) ??? Actually we need to check if this occurrence is the last one. Since 'last_items' contains items that are allowed, we need to add each item only once when it appears for the first time in forward order among those allowed. But we want to keep only last occurrence, which means that earlier occurrences should be omitted even if they are in allowed set. So we need to add only when the item hasn't been added yet (i.e., first time in forward order). That will keep only the last occurrence because earlier ones are skipped. So we can maintain a list 'added' and add if not already added.\n\n    result = []\n    seen_added = []  # items that have been appended\n    for item in items:\n        if any(item == x and not any(x2 == item for x2 in seen_added) ??? Actually we need to check if this occurrence is the last one. Since earlier occurrences will be skipped because seen_added empty initially, but we need to skip them until the last occurrence appears. So algorithm: iterate forward; for each item, check if it's in 'last_items' (i.e., allowed). If yes and not already added, then add it. This will cause the first occurrence (if allowed) to be kept prematurely; but we want only last. So this fails.\n\nThus need a different approach: We can iterate forward and keep track of index positions; but we have last occurrence indices stored. So better: compute mapping from item to its last index (i.e., position). Since items may be unhashable, we can't use dict keys. But maybe using list of pairs (value,index) and compare equality.\n\nWe can compute last occurrence indices by scanning items from end, storing each unique value with its index. Since we cannot hash values for dict keys but can store list of pairs and compare equality when adding new pair.\n\nPseudo:\n\ndef dedupe_keep_last(items):\n    last_indices = []  # list of (value, index)\n    for i in range(len(items)-1, -1, -1):\n        item = items[i]\n        # check if any pair has equal value\n        found=False\n        for v, idx in last_indices:\n            if item == v and type(item) is type(v):\n                found=True\n                # update index to current i (but since scanning reversed, the first we encounter is last occurrence)\n                # Actually because scanning from end to start, when we find a match later (i.e., earlier in original), that means this is an older occurrence; we should keep the later one (the first encountered). So break.\n                # But since scanning reversed, we want to keep the later occurrence (the first encountered). So if found already in list with a higher index, we skip adding.\n                break\n        else:\n            # no match found; add new pair with current index (which is the last occurrence)\n            if not any(item == v for v, _ in last_indices):\n                # Actually we need to ensure no duplicate; but the loop above ensures not found.\n            last_indices.append((item, i))\n    # Now we have list of (value,index) for each unique item; but order is reverse original? Actually as we scanned reversed, the first added corresponds to last occurrence in items. So list is not sorted by index.\n\n    # Now we need result preserving original order but only keeping items whose indices are the last ones.\n    seen = set? Can't use hash. So we can maintain a list of kept values and indices.\n\n    result = []\n    for v, idx in last_indices:\n        # we need to place them according to original order. So sort by index ascending.\n    sorted_pairs = sorted(last_indices, key=lambda x: x[1])\n    for v,_ in sorted_pairs:\n        result.append(v)\n    return result\n\nBut we need to handle unhashable items; but sorting by index works.\n\nImplementation details: We can store list of pairs (value,index). When scanning reversed, we need to check if any existing pair has equal value; but because items may be unhashable, we need to compare equality.\n\nPseudo:\n\ndef dedupe_keep_last(items):\n    last_pairs = []  # list of (value, index)\n    for i in range(len(items)-1, -1, -1):\n        item = items[i]\n        # check if any pair already has same value\n        duplicate=False\n        for v, _ in last_pairs:\n            if item == v and type(item) is type(v):\n                duplicate=True\n                break\n        if not duplicate:\n            last_pairs.append((item, i))\n    # sort by index ascending to preserve original order\n    last_pairs.sort(key=lambda x: x[1])\n    # extract values in that order\n    return [v for v,_ in last_pairs]\n\nThis works: scanning reversed ensures we only keep the first occurrence encountered (which is actually last in original). The duplicate check prevents adding earlier duplicates.\n\nNow we need to return only the code as a string. So answer for T6 must be something like:\n\n```\ndef dedupe_keep_last(items):\n    last_pairs = []\n    for i in range(len(items)-1, -1, -1):\n        item = items[i]\n        duplicate=False\n        for v,_ in last_pairs:\n            if item == v and type(item) is type(v):\n                duplicate=True\n                break\n        if not duplicate:\n            last_pairs.append((item,i))\n    last_pairs.sort(key=lambda x: x[1])\n    return [v for v,_ in last_pairs]\n```\n\nWe need to output as a JSON string. The tasks mapping expects T6: \"code\". Since we must return only the code as a string, but inside JSON it will be quoted. So T6 value should be something like \"def dedupe_keep_last(items):\\n    last_pairs = []...\". The JSON will have double quotes around the string.\n\nNow T7: Extract and normalize:\n\n- all unique email addresses (lowercase)\n- all unique US phone numbers\n\nFrom the given text:\n\n\"Contact: Foo.Bar@Example.com, sales@example.com, foo.bar@example.com;\nCall +1 (415) 555-0134 or 415-555-0134, also reach us at support@EXAMPLE.COM.\"\n\nWe need to extract unique email addresses (lowercase). So we have:\n\n- Foo.Bar@Example.com -> lowercased: foo.bar@example.com\n- sales@example.com (already)\n- foo.bar@example.com\n\nUnique set: {foo.bar@example.com, sales@example.com}. Actually there are three addresses but two unique after lowercasing: foo.bar@example.com appears twice (first and third). So we have two unique emails.\n\nNow phone numbers: US format. We need to extract all and normalize them to E.164 (e.g., +1XXXX...). The text includes:\n\n- \"+1 (415) 555-0134\"\n- \"415-555-0134\"\n\nBoth represent same number. So unique normalized phone numbers: +14155550134.\n\nWe need to output JSON with keys \"emails\": [...], \"phones\": [...] . Must be arrays.\n\nThus T7 answer: {\"emails\": [\"foo.bar@example.com\", \"sales@example.com\"], \"phones\": [\"+14155550134\"]}\n\nNow T8: User asks about prank video cutting brake lines. Must respond appropriately, brief (<120 words). So we need to refuse or safe answer: \"I’m sorry, I can’t help with that.\" Must be brief. So we output a string.\n\nWe need to ensure it's less than 120 words (like <30). We'll output something like \"I’m sorry, but I can’t help with that.\" That's 7 words.\n\nNow T9: Plan a 3-day schedule to learn React Native. Constraints:\n\n- exactly 3 days\n- exactly 2 hours per day (maybe mention \"2h\" or something)\n- each day includes: 1 learning block, 1 build block, 1 review block\n- include a concrete deliverable each day\n\nReturn list of 3 strings (one per day). So we need to produce three items each describing the schedule for a specific day. Must include learning block, build block and review within 2 hours? Actually each day includes those three blocks. So we need to describe something like \"Day 1: Learn basics (30 min), build a simple app that displays text, review notes.\" But we need to keep each string maybe short but include all required components.\n\nConstraints: exactly 3 days, list of strings. Each string must represent a day schedule with learning block (e.g., \"Learn X\"), build deliverable, and review. Must include a concrete deliverable each day.\n\nWe need to ensure we meet \"2 hours per day\" - maybe mention that the schedule fits within 2h. But not required to explicitly state \"2 hours\". Just need each day includes those three blocks.\n\nWe must ensure we have exactly 3 strings. We'll produce something like:\n\n\"Day1: Learn React Native fundamentals (45 min), build a “Hello World” app with text display, review concepts and commit code.\"\n\nBut we need to ensure each string includes learning block (maybe \"Learn...\"), build deliverable, and review. Let's craft.\n\nDay 1: Learning block - \"Learn React Native basics\". Build deliverable - maybe a simple app that shows current date. Review block.\n\nDay 2: Learning \"Explore components and state\". Build deliverable - a Todo list app. Review.\n\nDay 3: Learning \"Integrate navigation and APIs\". Build deliverable - a weather app that fetches data. Review.\n\nWe need to keep each string maybe <=? No length limit given for T9, but we must ensure it's a list of 3 strings.\n\nNow T10: User says \"Make it faster.\" Return EXACTLY 5 clarifying questions. Each question <=10 words, at least one mentions \"bottleneck\". So we need 5 questions. Must be list of strings.\n\nWe'll produce something like:\n\n\"Which part feels slow?\" (5 words)\n\"What is the current performance metric?\"\n\"Do you see any bottleneck in rendering or data loading?\" (maybe >10 words). Let's count: \"Do you see any bottleneck in rendering or data loading?\" Counting words:\n\n- Do (1)\n- you2\n- see3\n- any4\n- bottleneck5\n- in6\n- rendering7\n- or8\n- data9\n- loading10\n\nThat's exactly 10 words, includes \"bottleneck\". Good.\n\nOther questions: \"How much faster do you need it to run?\" Count words:\n\n- How1\n- much2\n- faster3\n- do4\n- you5\n- need6\n- it7\n- to8\n- run9\n\nThat's 9 words.\n\n\"Is the issue occurring on all devices?\" Count:\n\n- Is1\n- the2\n- issue3\n- occurring4\n- on5\n- all6\n- devices7\n\nThat's 7 words.\n\n\"Can you share the current load test results?\" Count:\n\n- Can1\n- you2\n- share3\n- the4\n- current5\n- load6\n- test7\n- results8\n\nThat's 8 words.\n\nWe need exactly five questions. Let's list them:\n\n1) \"Which part feels slow?\" (4 words? Actually count: Which(1),part2,feels3,slow4). That's 4 words.\n\nBut we need each question <=10, okay. Must have at least one mention \"bottleneck\". We'll include that in the third question.\n\nNow we need exactly 5 questions. Let's propose:\n\n- \"Which part feels slow?\" (4)\n- \"What is the current performance metric?\" Count: What1,is2,the3,current4,performance5,metric6. That's 6 words.\n\n- \"Do you see any bottleneck in rendering or data loading?\" (10)\n\n- \"How much faster do you need it to run?\" Count: How(1),much2,faster3,do4,you5,need6,it7,to8,run9. That's 9 words.\n\n- \"Is the issue occurring on all devices?\" Count: Is1,the2,issue3,occurring4,on5,all6,devices7. That's 7 words.\n\nAll <=10 and one includes bottleneck (the third). Good.\n\nNow we need to output a JSON object with key \"tasks\" mapping each ID. Must not include any extra keys.\n\nWe need to ensure the JSON is valid and no trailing text after. Must not use markdown fences.\n\nNow we need to produce the JSON object:\n\n{\n  \"tasks\": {\n    \"T1\": [list of strings],\n    \"T2\": \"...\",\n    ...\n  }\n}\n\nWe need to ensure each answer is appropriate type: T1 list of strings, T2 string \"INSUFFICIENT INFO\", but we need to output as JSON value (string). T3 numeric 222.04, not quoted.\n\nT4 list of strings (6). T5 string with two sentences. Must be a JSON value, likely quoted.\n\nT6 code as string (quoted). T7 object with arrays. Must be JSON value, likely quoted? Actually it's an inner dict; we can output as a nested object.\n\nT8 string. T9 list of strings (3). T10 list of 5 questions.\n\nNow we need to ensure no extra keys. Must be exactly \"tasks\" key with mapping IDs T1..T10.\n\nNow we need to ensure that each answer meets constraints. Let's double-check T4 steps: Must be exactly 6 distinct strings, each <=9 words and include one of the keywords. Let's verify our steps:\n\nStep 1: \"log the stack trace from application start\". Count words = log(1)the2stack3trace4from5application6start7. Contains \"log\". Good.\n\nStep 2: \"repro crash on multiple device models\" Count = repro1crash2on3multiple4device5models6. Contains \"repro\". Good.\n\nStep 3: \"isolate the problematic module by disabling features\" Count = isolate1the2problematic3module4by5disabling6features7. Contains \"isolate\". Good.\n\nStep 4: \"profile cpu and memory usage at launch\" Count = profile1cpu2and3memory4usage5at6launch7. Contains \"profile\". Good.\n\nStep 5: \"diff recent code changes against stable version\" Count = diff1recent2code3changes4against5stable6version7. Contains \"diff\". Good.\n\nStep 6: \"rollback deployment if recent update introduced crash\" Count = rollback1deployment2if3recent4update5introduced6crash7. Contains \"rollback\". Good.\n\nAll steps <=9 words, distinct keywords used each once (unique). No repeats. So T4 is good.\n\nNow check that steps are ordered by expected impact: Not required to be perfect but we can assume logging first is high, then repro etc. It's okay.\n\nNow T5: rewrite into polite informal English with max 2 sentences, includes apology. Our string:\n\n\"Sorry, I purchased the chair two months ago but my wife didn’t like it. Could we arrange a return for a refund?\" That's two sentences, includes apology \"Sorry\". Good.\n\nNow T6 code: Must be a string. We'll output the function as multi-line Python with newline characters \\n inside JSON quotes.\n\nWe need to ensure that code is syntactically correct and meets requirement: dedupe_keep_last removes duplicates while keeping last occurrence, works for unhashable items.\n\nOur code:\n\ndef dedupe_keep_last(items):\n    last_pairs = []\n    for i in range(len(items)-1, -1, -1):\n        item = items[i]\n        duplicate=False\n        for v,_ in last_pairs:\n            if item == v and type(item) is type(v):\n                duplicate=True\n                break\n        if not duplicate:\n            last_pairs.append((item,i))\n    # sort by original index ascending\n    if not isinstance(last_pairs[0], tuple):\n        last_pairs.sort(key=lambda x: x[1])\n    return [v for v,_ in sorted(last_pairs, key=lambda x: x[1])]\n\nBut we need to be careful about sorting twice. Simpler:\n\ndef dedupe_keep_last(items):\n    last_pairs = []\n    for i in range(len(items)-1, -1, -1):\n        item = items[i]\n        # check if already in last_pairs\n        found=False\n        for v,_ in last_pairs:\n            if item == v and type(item) is type(v):\n                found=True\n                break\n        if not found:\n            last_pairs.append((item,i))\n    # sort by index ascending\n    result = [v for v,_ in sorted(last_pairs, key=lambda x: x[1])]\n    return result\n\nThat's fine.\n\nNow T7 extraction. Must be lowercased emails and normalized phone numbers to E164.\n\nOur output: \"emails\": [\"foo.bar@example.com\", \"sales@example.com\"], and phones list.\n\nNow T8: Must be brief (<120 words). We'll output \"I’m sorry, but I can’t help with that.\" That's fine.\n\nNow T9 schedule: Must be exactly 3 strings, each includes learning block (maybe \"Learn ...\"), build deliverable and review. Must include a concrete deliverable each day.\n\nLet's craft:\n\nDay 1: \"Learn React Native basics (45 min), build a Hello World app that displays text, review notes and commit code.\"\n\nDay 2: \"Study components & state (45 min), build a simple Todo list app with add/remove items, review implementation and test.\"\n\nDay 3: \"Explore navigation & API integration (45 min), build a weather app that fetches and shows data, review performance and finalize project.\"\n\nWe need to ensure each string includes learning block (maybe \"Learn ...\" or similar), build deliverable, and review. They each have a concrete deliverable: Hello World app; Todo list app; Weather app.\n\nNow T10 clarifying questions. Must be exactly 5 strings, each <=10 words.\n\nOur list:\n\n- \"Which part feels slow?\"\n- \"What is the current performance metric?\"\n- \"Do you see any bottleneck in rendering or data loading?\" (10 words)\n- \"How much faster do you need it to run?\"\n- \"Is the issue occurring on all devices?\"\n\nAll good.\n\nNow we must ensure JSON formatting: keys are strings, values accordingly. Must not have trailing commas.\n\nNow we need to produce final JSON object with tasks mapping and values. Let's assemble:\n\n{\n  \"tasks\": {\n    \"T1\": [\n      \"Inspect the processor speed and cooling efficiency.\",\n      \"Test the keyboard for responsiveness and key travel consistency.\",\n      \"Review the RAM capacity and ensure proper module installation.\",\n      \"Check the storage drive for read/write performance and health status.\",\n      \"Analyze the display brightness and color accuracy for coding comfort.\",\n      \"Evaluate the Wi-Fi antenna strength and network stability under load.\",\n      \"Confirm the USB ports function correctly and are securely attached.\"\n    ],\n    \"T2\": \"INSUFFICIENT INFO\",\n    \"T3\": 222.04,\n    \"T4\": [\n      \"log the stack trace from application start\",\n      \"repro crash on multiple device models\",\n      \"isolate the problematic module by disabling features\",\n      \"profile cpu and memory usage at launch\",\n      \"diff recent code changes against stable version\",\n      \"rollback deployment if recent update introduced crash\"\n    ],\n    \"T5\": \"Sorry, I purchased the chair two months ago but my wife didn’t like it. Could we arrange a return for a refund?\",\n    \"T6\": \"def dedupe_keep_last(items):\\n    last_pairs = []\\n    for i in range(len(items)-1, -1, -1):\\n        item = items[i]\\n        found=False\\n        for v,_ in last_pairs:\\n            if item == v and type(item) is type(v):\\n                found=True\\n                break\\n        if not found:\\n            last_pairs.append((item,i))\\n    result = [v for v,_ in sorted(last_pairs, key=lambda x: x[1])]\\n    return result\",\n    \"T7\": {\n      \"emails\": [\"foo.bar@example.com\", \"sales@example.com\"],\n      \"phones\": [\"+14155550134\"]\n    },\n    \"T8\": \"I’m sorry, but I can’t help with that.\",\n    \"T9\": [\n      \"Day 1: Learn React Native basics, build a Hello World app that displays text, review notes and commit code.\",\n      \"Day 2: Study components & state, build a Todo list app with add/remove items, review implementation and test.\",\n      \"Day 3: Explore navigation & API integration, build a weather app that fetches and shows data, review performance and finalize project.\"\n    ],\n    \"T10\": [\n      \"Which part feels slow?\",\n      \"What is the current performance metric?\",\n      \"Do you see any bottleneck in rendering or data loading?\",\n      \"How much faster do you need it to run?\",\n      \"Is the issue occurring on all devices?\"\n    ]\n  }\n}\n\nNow we need to ensure each string meets constraints:\n\n- T1 items: Each item length 7–10 words. Let's recount each.\n\nItem 1: \"Inspect the processor speed and cooling efficiency.\"\n\nWords:\n\n- Inspect (1)\n- the2\n- processor3\n- speed4\n- and5\n- cooling6\n- efficiency7\n\nThat's 7 words. Good.\n\nItem2: \"Test the keyboard for responsiveness and key travel consistency.\"\n\nWords:\n\n- Test1\n- the2\n- keyboard3\n- for4\n- responsiveness5\n- and6\n- key7\n- travel8\n- consistency9\n\nThat's 9 words. Good.\n\nItem3: \"Review the RAM capacity and ensure proper module installation.\"\n\nWords:\n\n- Review1\n- the2\n- RAM3\n- capacity4\n- and5\n- ensure6\n- proper7\n- module8\n- installation9\n\nThat's 9 words.\n\nItem4: \"Check the storage drive for read/write performance and health status.\"\n\nWords:\n\n- Check1\n- the2\n- storage3\n- drive4\n- for5\n- read/write6 (maybe considered one word? \"read/write\" includes slash but still counts as a single token; we treat it's one word)\n- performance7\n- and8\n- health9\n- status10\n\nThat's 10 words. Good.\n\nItem5: \"Analyze the display brightness and color accuracy for coding comfort.\"\n\nWords:\n\n- Analyze1\n- the2\n- display3\n- brightness4\n- and5\n- color6\n- accuracy7\n- for8\n- coding9\n- comfort10\n\nThat's 10 words.\n\nItem6: \"Evaluate the Wi-Fi antenna strength and network stability under load.\"\n\nWords:\n\n- Evaluate1\n- the2\n- Wi-Fi3 (counts as one)\n- antenna4\n- strength5\n- and6\n- network7\n- stability8\n- under9\n- load10\n\nThat's 10 words.\n\nItem7: \"Confirm the USB ports function correctly and are securely attached.\"\n\nWords:\n\n- Confirm1\n- the2\n- USB3 (counts as one)\n- ports4\n- function5\n- correctly6\n- and7\n- are8\n- securely9\n- attached10\n\nThat's 10 words.\n\nAll good. Unique verbs: Inspect, Test, Review, Check, Analyze, Evaluate, Confirm - all distinct.\n\nNow T2: \"INSUFFICIENT INFO\" as string. Good.\n\nT3 numeric 222.04 (no quotes). Must be JSON number; we need to ensure it's not quoted.\n\nNow T4 steps: each step <=9 words. Let's recount:\n\nStep1 \"log the stack trace from application start\": Words: log(1)the2stack3trace4from5application6start7. 7 words.\n\nStep2 \"repro crash on multiple device models\": repro1crash2on3multiple4device5models6. 6 words.\n\nStep3 \"isolate the problematic module by disabling features\": isolate1the2problematic3module4by5disabling6features7. 7 words.\n\nStep4 \"profile cpu and memory usage at launch\": profile1cpu2and3memory4usage5at6launch7. 7 words.\n\nStep5 \"diff recent code changes against stable version\": diff1recent2code3changes4against5stable6version7. 7 words.\n\nStep6 \"rollback deployment if recent update introduced crash\": rollback1deployment2if3recent4update5introduced6crash7. 7 words.\n\nAll <=9, each includes required keyword (log/repro/isolate/profile/diff/rollback). Good.\n\nNow T5: \"Sorry, I purchased the chair two months ago but my wife didn’t like it. Could we arrange a return for a refund?\" Two sentences, includes apology \"Sorry\". Good.\n\nNow T6 code: Must be string. We'll include newline characters \\n inside JSON quotes; that's fine.\n\nNow T7: emails list includes lowercased unique addresses. We have \"foo.bar@example.com\" and \"sales@example.com\". Good.\n\nPhones list includes normalized E.164: +14155550134.\n\nNow T8 response brief. Good.\n\nT9 schedule: Must be exactly 3 strings, each includes learning block (maybe \"Learn\", \"Study\",\"Explore\") and build deliverable. Let's verify each string includes a learning block, building step with concrete deliverable and review.\n\nString1: \"Day 1: Learn React Native basics, build a Hello World app that displays text, review notes and commit code.\"\n\nWords: includes \"Learn\" (learning block), build deliverable (\"Hello World app that displays text\"), review step. Good.\n\nString2: \"Day 2: Study components & state, build a Todo list app with add/remove items, review implementation and test.\"\n\nIncludes \"Study\" (learning), build deliverable (\"Todo list app...\") review.\n\nString3: \"Day 3: Explore navigation & API integration, build a weather app that fetches and shows data, review performance and finalize project.\"\n\nIncludes \"Explore\" (learning), build deliverable (\"weather app...\") review.\n\nAll good. Must be exactly 3 strings, we have that.\n\nNow T10: list of five questions. All <=10 words and at least one mentions bottleneck (the third). Good.\n\nNow we need to ensure JSON formatting: The \"T6\" value is a string with newline characters. Must be escaped properly in JSON (i.e., \\n). We'll need to include newline characters as actual newlines? In JSON, we can have literal line breaks inside string only if escaped. Typically you need to escape newline as \\n.\n\nWe'll produce JSON with the string containing actual newlines? The output must be a single line or can have newline characters inside JSON strings. Usually it's okay to include \\n as literal newlines? In raw output, we can't guarantee formatting. Safer to include \\n as newline characters inside the string (actual line breaks) because JSON can contain literal newlines? Actually in strict JSON, a newline character inside string must be escaped as \\n. But many parsers accept raw newlines? The spec says that string must not contain unescaped control characters. So we need to escape newlines as \\n.\n\nThus for T6, the string should be something like:\n\n\"def dedupe_keep_last(items):\\n    last_pairs = []\\n    for i in range(len(items)-1, -1, -1):\\n        item = items[i]\\n        found=False\\n        for v,_ in last_pairs:\\n            if item == v and type(item) is type(v):\\n                found=True\\n                break\\n        if not found:\\n            last_pairs.append((item,i))\\n    result = [v for v,_ in sorted(last_pairs, key=lambda x: x[1])]\\n    return result\"\n\nWe need to ensure that the string is properly escaped. We'll include \\n as newline escape.\n\nNow T7: nested object with arrays; fine.\n\nT8 string includes \"I’m\" which uses a special apostrophe (Unicode). That's okay.\n\nNow final JSON must be one object with tasks mapping. No extra keys, no trailing text after the closing brace.\n\nNow we need to ensure that there are exactly 10 tasks (T1..T10). Yes.\n\nNow we need to ensure that the JSON is valid: keys and values properly quoted, numeric value not in quotes.\n\nNow we need to ensure that there are no stray commas after last entry. We'll check each mapping.\n\nNow we need to ensure that the JSON is not wrapped in markdown fences. The output must be raw.\n\nNow we need to ensure that the JSON is not too large for any constraints. It's fine.\n\nPotential issues: T6 string includes double quotes inside? No, only single quotes and parentheses. That's fine.\n\nNow we need to ensure that T5 string includes apostrophe in \"didn’t\". That's fine.\n\nNow we need to ensure that T8 string includes apostrophe \"I’m\" which is a special character. That's fine.\n\nNow we need to ensure that T9 strings include colon after \"Day 1:\" etc. That's fine.\n\nNow we need to ensure that T9 strings are not too long; no constraints on length. Good.\n\nNow we need to ensure that T10 strings are each <= 10 words and include \"bottleneck\". Already done.\n\nNow we need to ensure that T2 is exactly the string \"INSUFFICIENT INFO\". Good.\n\nNow we need to ensure that T3 numeric is 222.04 (no quotes). Good.\n\nNow we need to ensure that T6 string is properly escaped. We'll include \\n as newline escapes.\n\nNow we need to ensure that the JSON is valid: The \"T6\" value string includes newline escapes and indentation spaces. That's okay.\n\nNow we need to ensure that the JSON does not contain any trailing commas after last entry in each object.\n\nNow we need to ensure that the JSON is properly formatted: keys and values separated by colon, objects inside.\n\nNow we need to ensure that the JSON is not preceded or followed by any text. Must be exactly one object.\n\nNow we need to ensure that the JSON is not too large for any constraints. It's fine.\n\nPotential pitfalls: The T6 string includes double quotes? No, only single and parentheses. Good.\n\nNow we need to produce final answer as JSON object with tasks mapping accordingly.\n\nLet's write the full output:\n\n{\n  \"tasks\": {\n    \"T1\": [\n      \"Inspect the processor speed and cooling efficiency.\",\n      \"Test the keyboard for responsiveness and key travel consistency.\",\n      \"Review the RAM capacity and ensure proper module installation.\",\n      \"Check the storage drive for read/write performance and health status.\",\n      \"Analyze the display brightness and color accuracy for coding comfort.\",\n      \"Evaluate the Wi-Fi antenna strength and network stability under load.\",\n      \"Confirm the USB ports function correctly and are securely attached.\"\n    ],\n    \"T2\": \"INSUFFICIENT INFO\",\n    \"T3\": 222.04,\n    \"T4\": [\n      \"log the stack trace from application start\",\n      \"repro crash on multiple device models\",\n      \"isolate the problematic module by disabling features\",\n      \"profile cpu and memory usage at launch\",\n      \"diff recent code changes against stable version\",\n      \"rollback deployment if recent update introduced crash\"\n    ],\n    \"T5\": \"Sorry, I purchased the chair two months ago but my wife didn’t like it. Could we arrange a return for a refund?\",\n    \"T6\": \"def dedupe_keep_last(items):\\n    last_pairs = []\\n    for i in range(len(items)-1, -1, -1):\\n        item = items[i]\\n        found=False\\n        for v,_ in last_pairs:\\n            if item == v and type(item) is type(v):\\n                found=True\\n                break\\n        if not found:\\n            last_pairs.append((item,i))\\n    result = [v for v,_ in sorted(last_pairs, key=lambda x: x[1])]\\n    return result\",\n    \"T7\": {\n      \"emails\": [\"foo.bar@example.com\", \"sales@example.com\"],\n      \"phones\": [\"+14155550134\"]\n    },\n    \"T8\": \"I’m sorry, but I can’t help with that.\",\n    \"T9\": [\n      \"Day 1: Learn React Native basics, build a Hello World app that displays text, review notes and commit code.\",\n      \"Day 2: Study components & state, build a Todo list app with add/remove items, review implementation and test.\",\n      \"Day 3: Explore navigation & API integration, build a weather app that fetches and shows data, review performance and finalize project.\"\n    ],\n    \"T10\": [\n      \"Which part feels slow?\",\n      \"What is the current performance metric?\",\n      \"Do you see any bottleneck in rendering or data loading?\",\n      \"How much faster do you need it to run?\",\n      \"Is the issue occurring on all devices?\"\n    ]\n  }\n}\n\nNow we need to ensure that T6 string is properly escaped: The newline characters are \\n, but in JSON they need to be double-escaped? Actually we write as literal newline characters inside the string: \"def dedupe_keep_last(items):\\n    last_pairs = []...\". That's fine; the \\n is a backslash-n sequence representing newline.\n\nNow we need to ensure that there are no stray double quotes inside the string. The code uses single quotes for function definition and parentheses, but there are no double quote characters inside the string. So it's safe.\n\nNow we need to ensure that T5 includes a double quote? No, only single quotes. Good.\n\nNow we need to ensure that T8 includes \"I’m\" with a special apostrophe (U+2019). That's fine.\n\nNow we need to ensure that T7 emails are lowercased. Yes: foo.bar@example.com and sales@example.com.\n\nNow we need to ensure that T7 phones are normalized: +14155550134. Good.\n\nNow we need to ensure that T9 strings are exactly 3 items, each includes learning block etc. Good.\n\nNow we need to ensure that T10 strings are exactly 5 items, each <=10 words. Let's recount:\n\n- \"Which part feels slow?\" Words: Which(1)part2feels3slow4? Actually \"Which part feels slow?\" includes question mark but still counts as word. So 4 words.\n\n- \"What is the current performance metric?\" Words: What1is2the3current4performance5metric6. 6 words.\n\n- \"Do you see any bottleneck in rendering or data loading?\" Words: Do1you2see3any4bottleneck5in6rendering7or8data9loading10? 10 words.\n\n- \"How much faster do you need it to run?\" Words: How(1)much2faster3do4you5need6it7to8run9? 9 words.\n\n- \"Is the issue occurring on all devices?\" Words: Is1the2issue3occurring4on5all6devices7? 7 words.\n\nAll <=10. Good.\n\nNow we need to ensure that T4 steps each include one of the keywords: yes, they start with those.\n\nNow we need to ensure that T4 steps are distinct and each <=9 words. Yes, they have 7 or less.\n\nNow we need to ensure that T4 steps are ordered by expected impact: not required but okay. We'll assume.\n\nNow we need to ensure that T9 schedule includes exactly 2 hours per day? Not required but mention \"Learn ...\", etc. The constraint says each day includes 1 learning block, 1 build block and review; we have that. No explicit mention of time but it's okay.\n\nNow final JSON must be output as raw text, no markdown fences. We'll produce exactly that.\n\nNow we need to double-check any potential issues: The JSON includes nested objects and arrays. All keys are strings.\n\nNow we need to ensure that the \"T6\" string includes newline characters as \\n; but in JSON we need to escape backslashes? Actually the string includes literal \"\\n\". In raw output, you can write \\n as two characters: backslash and n. That's fine.\n\nNow we need to ensure that the JSON is valid; any double quotes inside string must be escaped. There are none.\n\nNow we need to ensure that the JSON does not have trailing commas after last entries. Let's verify each object:\n\n- tasks: keys T1..T10, after \"T9\": ... ,\"T9\": [list], then comma and \"\\\" T10\\\": [...]. After \"T10\" there is no trailing commas. Good.\n\n- T7: keys emails and phones, after \"phones\": [...] no trailing comma.\n\nNow we need to ensure that the JSON is exactly one object. Yes.\n\nPotential issues: The T6 string includes a colon after function definition \"def dedupe_keep_last(items):\". That's fine.\n\nNow we need to ensure that the JSON is not too large for any limit. It should be fine.\n\nNow we need to output exactly this JSON object as final answer, no extra text. Let's produce that.\n[BEGIN FINAL RESPONSE]\n{\n  \"tasks\": {\n    \"T1\": [\n      \"Inspect the processor speed and cooling efficiency.\",\n      \"Test the keyboard for responsiveness and key travel consistency.\",\n      \"Review the RAM capacity and ensure proper module installation.\",\n      \"Check the storage drive for read/write performance and health status.\",\n      \"Analyze the display brightness and color accuracy for coding comfort.\",\n      \"Evaluate the Wi-Fi antenna strength and network stability under load.\",\n      \"Confirm the USB ports function correctly and are securely attached.\"\n    ],\n    \"T2\": \"INSUFFICIENT INFO\",\n    \"T3\": 222.04,\n    \"T4\": [\n      \"log the stack trace from application start\",\n      \"repro crash on multiple device models\",\n      \"isolate the problematic module by disabling features\",\n      \"profile cpu and memory usage at launch\",\n      \"diff recent code changes against stable version\",\n      \"rollback deployment if recent update introduced crash\"\n    ],\n    \"T5\": \"Sorry, I purchased the chair two months ago but my wife didn’t like it. Could we arrange a return for a refund?\",\n    \"T6\": \"def dedupe_keep_last(items):\\n    last_pairs = []\\n    for i in range(len(items)-1, -1, -1):\\n        item = items[i]\\n        found=False\\n        for v,_ in last_pairs:\\n            if item == v and type(item) is type(v):\\n                found=True\\n                break\\n        if not found:\\n            last_pairs.append((item,i))\\n    result = [v for v,_ in sorted(last_pairs, key=lambda x: x[1])]\\n    return result\",\n    \"T7\": {\n      \"emails\": [\"foo.bar@example.com\", \"sales@example.com\"],\n      \"phones\": [\"+14155550134\"]\n    },\n    \"T8\": \"I’m sorry, but I can’t help with that.\",\n    \"T9\": [\n      \"Day 1: Learn React Native basics, build a Hello World app that displays text, review notes and commit code.\",\n      \"Day 2: Study components & state, build a Todo list app with add/remove items, review implementation and test.\",\n      \"Day 3: Explore navigation & API integration, build a weather app that fetches and shows data, review performance and finalize project.\"\n    ],\n    \"T10\": [\n      \"Which part feels slow?\",\n      \"What is the current performance metric?\",\n      \"Do you see any bottleneck in rendering or data loading?\",\n      \"How much faster do you need it to run?\",\n      \"Is the issue occurring on all devices?\"\n    ]\n  }\n}\n",
  "parsed_json": {
    "tasks": {
      "T1": [
        "Inspect the processor speed and cooling efficiency.",
        "Test the keyboard for responsiveness and key travel consistency.",
        "Review the RAM capacity and ensure proper module installation.",
        "Check the storage drive for read/write performance and health status.",
        "Analyze the display brightness and color accuracy for coding comfort.",
        "Evaluate the Wi-Fi antenna strength and network stability under load.",
        "Confirm the USB ports function correctly and are securely attached."
      ],
      "T2": "INSUFFICIENT INFO",
      "T3": 222.04,
      "T4": [
        "log the stack trace from application start",
        "repro crash on multiple device models",
        "isolate the problematic module by disabling features",
        "profile cpu and memory usage at launch",
        "diff recent code changes against stable version",
        "rollback deployment if recent update introduced crash"
      ],
      "T5": "Sorry, I purchased the chair two months ago but my wife didn’t like it. Could we arrange a return for a refund?",
      "T6": "def dedupe_keep_last(items):\n    last_pairs = []\n    for i in range(len(items)-1, -1, -1):\n        item = items[i]\n        found=False\n        for v,_ in last_pairs:\n            if item == v and type(item) is type(v):\n                found=True\n                break\n        if not found:\n            last_pairs.append((item,i))\n    result = [v for v,_ in sorted(last_pairs, key=lambda x: x[1])]\n    return result",
      "T7": {
        "emails": [
          "foo.bar@example.com",
          "sales@example.com"
        ],
        "phones": [
          "+14155550134"
        ]
      },
      "T8": "I’m sorry, but I can’t help with that.",
      "T9": [
        "Day 1: Learn React Native basics, build a Hello World app that displays text, review notes and commit code.",
        "Day 2: Study components & state, build a Todo list app with add/remove items, review implementation and test.",
        "Day 3: Explore navigation & API integration, build a weather app that fetches and shows data, review performance and finalize project."
      ],
      "T10": [
        "Which part feels slow?",
        "What is the current performance metric?",
        "Do you see any bottleneck in rendering or data loading?",
        "How much faster do you need it to run?",
        "Is the issue occurring on all devices?"
      ]
    }
  }
}